,0
0,"Сменил снайпу на нож.
-4750$"
1,
2,скинул дроп
3,А они её потом домой утащили???🙄🤔
4,Дропнул авик сильверам
5,
6,"А у меня нет винтовки, но есть телефон всего за 2990р и я очень радуюсь 🙂"
7,Совсем как бы не заметно его
8,Лох🤣
9,
10,"Отнеситесь с пониманием, это отрицаетельный рывок"
11,"Это крепный российский ремонт, то вы сдать, а потом все развалится и можно еще раз выделить денег и разворовать."
12,"[id233830930|Максим], а омериканци нашим технологиям завидуют )))))"
13,Забыли майонез и кетчуп положить 🙃 я всегда так делаю...
14,в Белоруссии ты б за этот бутер лет на 5 бы загремел)
15,"[id757606147|Вазелиновый], хороший комментарий 🙂"
16,Так воду сушат потом катком греют и окончательно уже ламинируют.
17,"Русофобия — это когда ты не знаешь, как и чем живет твой народ. Не ходишь с ним по одним улицам, не ездишь в одном транспорте, ешь другую пищу. Когда ты мчишься с кортежем по пустым дорогам, а люди из-за тебя часами стоят в пробках. Когда перед твоим приездом в провинцию кладут однодневный асфальт и весёленько раскрашивают убогие хибары."
18,"[id190528506|Григорий], Русофобия — предвзятое, подозрительное, неприязненное, враждебное отношение к русскому народу, России, русскому языку, специфическое направление в этнофобии (в более узком смысле — страх перед Россией или курсом российской внешней политики). По мнению некоторых специалистов, русофобия, как и антисемитизм, в отличие от большинства других национальных фобий, часто выступает как цельная идеология, то есть как особый комплекс идей и концепций, имеющий свою структуру, систему понятий, историю генезиса и развития, а также свои типичные проявления. 

Бб"
19,Спасибо вам большое за такой труд если в. Не вы то Я бы провалился в яму и пострадала машина. Спасибо
20,Спасибо вам большое за такой труд если в. Не вы то Я бы провалился в яму и пострадала машина. Спасибо
21,"Просто все ноют,лужи,грязь,снег, лёд. Поэтому лужи убирают😆"
22,"Не делать и ждать пока просохнет будут бубнить, когда ямы заделают, делать будут бубнить что не по фен-шую"
23,В пидарашке ничего не меняется
24,"[id767288953|Яблочный],"
25,"С такими проще всего, сказал при первом же свидании, что влюбился, готов жениться, ребенка усыновишь, сделал дело, ушел))"
26,"[id133988739|Артём], нельзя так, она и так страданула🤣"
27,"[id558311383|خيقلل-هاذط], Как говорится, если терпила то по жизни(("
28,"кстати на второй фотке, если убрать узбечонка, то ниче такая)"
29,"[id133988739|Артём], жиза брат, жиза"
30,"[id133988739|Артём], пздц. На дешёвую китайскую копию Ленина похож, сам дрыщ, а ещё из себя мачо строит. Да ты внешне ей в миллиард раз проигрываешь. И любой девушке. Только убогая и согласится замутить. 
Всем бы такую уверенность в себе как страшилам"
31,"[id558311383|خيقلل-هاذط], а чё страдала то?)) Говорят процесс приятный, совсем не больно, разве что первый раз, но это не тот случай, уверен 😆😆😆"
32,"[id405251797|Елена], зачем так оскорблять его? Он верно сказал. И в таком положении, девушка не будет особо смотреть на внешность"
33,"[id405251797|Елена], во первых я на фото не очень получаюсь + обгорел на юге Казахстана, дрищ да и не спорю, но с Ильичем еще никто не сравнивал🤣, а с уверенностью да, потому что так делал, пройденно! У тебя вообще профиль закрыт, твою фотку глянуть, наверняка обиженка какае то, фемка 100кг🤣"
34,"[id9943430|Алексей], у украинок почему первый раз должен быть больно?"
35,"[id133988739|Артём], а опыт у тебя есть  я так посмотрю) любишь в бу чернильницу  свой хоботок макать?)"
36,"Пусть в турции и нигерии поищет, соберет полное комбо чернильницы."
37,"[id757606147|Вазелиновый], турки не черные"
38,"[id362843540|Алиса], Наташа, ты?"
39,"[id362843540|Алиса], Ты уже видимо опытная в этом вопросе🤣"
40,"[id362843540|Алиса], а какие ?"
41,"[id3616181|Анна], копченые"
42,"[id70036279|Максим], хорошо не вяленные"
43,"[id362843540|Алиса], ага,зелёные"
44,"[id362843540|Алиса], по сути, ты такая же как она"
45,"[id362843540|Алиса], черно-белые? 🌝"
46,"[id757606147|Вазелиновый], украинка же. Там это норма"
47,"налетайте, пацаны 😂"
48,"[id791860949|Roni], как можно дать узбеку, насколько надо себя не уважать"
49,"[id791860949|Roni], и родить от него)"
50,"[id791860949|Roni], я думал это твоя сестра"
51,"[id688585327|Джас], задело да, кумысик? 😋"
52,Так тебя. Же. Задело мне в кайф хахаха
53,"[id791860949|Roni], как будто у украинцев есть честь? Пффф"
54,"[id688585327|Джас], заметил что твой высер почти под каждым комментарием😁 тебя что именно так бомбит? Можешь объяснить?"
55,"[id56937287|Виктор], смотрю бомбонуло Васи"
56,"[id688585327|Джас], какого Васи?"
57,"[id56937287|Виктор], васяна"
58,
59,"[id746882154|Николай], 🤣🤣🤣🤣🤣👍👍👍👍👍👍👍🤣🤣🤣🤣🤣"
60,"[id746882154|Николай], хахахахах"
61,Накуй не нужна содержанка
62,"[id273522846|Александр], хахаха согл ещо и с чуркой приедет"
63,Больше с узбеками снашайтесь
64,"[id672075080|Кирилл], 👏😆"
65,Мерзость
66,Adмиn свою родную сестру сватает
67,"[id291816200|Владимир], маму"
68,"Сколько ещё таких дурёх по России? Где вы, мозги свои просираете 🤦?"
69,"[id162392351|Дмитрий], це хохлыня"
70,"[id162392351|Дмитрий], так она из свинницы"
71,Так у нас таких дофига и тележка.
72,"[id162392351|Дмитрий], так берём этот пример."
73,"[id704922465|Скрипкин], при чём здесь хохлыня, если у нас реально полно чернильниц"
74,Прокатилась на Я*декс такси?
75,"[id195967377|Василий], в Украине нет яндекс такси"
76,"[id693324390|Непомню], причем здесь Украина?"
77,"[id182815324|Альберт], она украинка."
78,"[id182815324|Альберт], потому це дивчина украинка из сВинницы, маленького узбека дениской назвала.
Наверное вот причём."
79,
80,"Миска риса, шью одежду,
Бизнес - это не так просто,
Если что - скажу простынка,
В Азии - немного толстых."
81,А у меня корейскому телефону 15 лет и отлично работает 🙄
82,а я покакал утром
83,"[id571142278|Ярик], ты че, с бабским телефоном гоняешь чтоли? 😂"
84,"[id164896441|Егор], он тогда продавался со скидкой и я купил 🙂"
85,"[id571142278|Ярик], так он женский же"
86,"[id164896441|Егор], где написано?"
87,"[id164896441|Егор],"
88,"[id654168932|Владислав], на нем и написано, la fleur это женская линейка"
89,"[id164896441|Егор], да пофиг, тем более если по скидке был тогда)"
90,"а магазины нижнего белья для них 
""Одежда для вымя """
91,"[id610493597|Эхнатон], ну блин"
92,"Тем временем местная фемка-бодипозитивщица алин очка из 0ъ класса, которая посмотрела данное видео:"
93,
94,Факт
95,😂
96,"[id740183508|Призрак], фитоняшка"
97,
98,"Обожаю именно эту черту азиатских стран. Пока по всему миру кучка шизиков бегает с криками о объективизации женских образов в фильмах и играх - они делают именно то что нравиться людям. Если файтинг- обязательно куча максимально обнажённой женской натуры. И тут, жирный есть жирный..."
99,"[id5814475|Вячеслав], ну так и про мужчин можно сказать также."
100,"[id405251797|Елена], именно"
101,Бузова тоже идёт в комплекте?
102,"[id427113507|Александр], хаахахах"
103,Че за уродство
104,"Дева Мария! Я клянусь, я хочу измениться!"
105,
106,"Наконец-то counter strike 1.6 обновили до 2.0 , спустя 20 летет🗿"
107,Наконец то тестеры поиграли в стендофф 2
108,"[id716897541|Егор], ты про тех, что повеселись, лишь бы не играть в это дерьмо?"
109,
110,"[id124049629|Максим],"
111,"Короче, на наших компах можно чайник вскипятить, а они всё равно её не потянут"
112,"[id610493597|Эхнатон], кс на картошке идёт"
113,
114,"[id610493597|Эхнатон], кулер от корсар - уже хорошо."
115,"[id610493597|Эхнатон], заварю ка я чайку"
116,Давайте же насладимся новой графикой в этой игре по видосам 480р
117,Молики кидающиеся об скайбоксы...
118,"[id259561038|Кирилл], да, с шорта на бокс на дасте2.. F"
119,"[id394993102|Артем], с бокса на машину"
120,Помойка.
121,"Для админа и таких же дурачков. 
только в тренировочном режиме показывает куда прилетят гранаты"
122,"[id452142467|Vitaly], – ""раскидывать гранаты теперь проще: на свои серверы добавили предпросмотр траектории падения гранаты"" читать научись клоун"
123,"[id394993102|Артем], слыш, клоун, прежде чем что то сказать мне, убедись, что ты был прав.
Если не видел, что было до этого написано,  то не лезь сюда"
124,Понятно дермо короче...
125,Только 1.6!
126,Как была кс говном так и осталась
127,"[id154639015|Семён], так ещё хуже стало"
128,"[id610602368|Павел], почему Вы так решили?"
129,"[id348354465|Алёша], вижу"
130,как говорится на стопервый раз получится
131,"[id610493597|Эхнатон], раз в несколько лет такое только можно увидеть, в общем история"
132,"[id610493597|Эхнатон], не в свои и то ладно))"
133,Как обычно все у ноунейм игроков происходит
134,"[id151672967|Альберт], может, это оттого, что о ноунеймах узнают именно по этим моментам?"
135,
136,"[id151672967|Альберт], что именно?) Договорные матчи? Согласен"
137,"[id86691881|Кирилл], да нееееееее, ни разу не договорняк!!!!! Вон, как быстро второй вратарь шел за мячом 😂😂😂😂😂😂 Просто мастерство!😂😂"
138,"[id8290827|Анатолий], та нормально он за ним бежал"
139,Хороший кэф сделали)
140,🥅⚽️🥅
141,Зачеееет 👍🤦‍♂️🤣
142,В детстве такой гол не считался. Слишком лёгкий уровень
143,"[id148478027|Эльмир], в детстве и расстояние до ворот было меньше обычно 😂"
144,"[id148478027|Эльмир], в детстве между воротами три метра было от силы💀"
145,"[id151737383|Ибрагим], ты в подвале играл?"
146,"[id558311383|خيقلل-هاذط], было такое, да."
147,"[id166034101|Альберт], в школе большое поле было у нас"
148,от ворот до ворот не считается
149,"[id548971073|Герман], Кто тебе сказал?"
150,"[id36078893|Писарев], дворовое детство"
151,"[id36078893|Писарев], от ворот бьётся свободный удар, а свободный удар, и с такого розыгрыша прямым ударом забивать нельзя. Только плохо видно, коснулся ли кипер другой мяча, если да, то гол чистый, если мяч сквозняк пролетел после удара, то гол засчитывать нельзя"
152,"[id216594354|Артём], Гол все равно в зачет идет. Даже если вратарь кинет руками от своих ворот, хоть и не докинет. Или из аута кто-то кинет руками в ворота и попадет, это не гол?"
153,"[id36078893|Писарев], из аута прямым бросков тоже не гол, если зацепит кого то мяч, то гол, такая как из акта офсайда нет"
154,"[id216594354|Артём], Всмысле тоже не гол? Гол 😁Как и от ворот до ворот."
155,"[id36078893|Писарев], ещё есть вариант, что он штафной удар бил, условно из за блокировки вратаря или на полевом игроке кто то сфолил в той точке, тогда прямым можно"
156,"[id36078893|Писарев], https://www.fifa.com/legal/documents"
157,"Даже если просто от ворот. Он вводил мяч в игру ,то есть мяч в игре после его удара"
158,"[id36078893|Писарев], сначала правила почитай, потом говори, ссылку скинул, разберешьмя"
159,
160,"[id602508574|Михаил], причём тут, сейчас твой понос?"
161,"[id602508574|Михаил], не уж то на первом месте США? И тут мы проиграли Западу, эх! :("
162,"Вратарь, пропустивший мяч."
163,"[id176156787|Азат], вратарь, забивший гол."
164,"[id176156787|Азат], народ никто не знает марий эл это где??? де накормили тонной пряников медведей))"
165,"[id767426786|Андрей], загугли, собака ты тупая. Как ты дожил до своего возраста?"
166,Гооооооооооооооолллллл
167,Не хочу
168,Куда нелепую бабку в очках дели
169,Такое давно с помощью нейросети можно сделать...
170,"[id552225977|German], по сути этим и занимается эта группа. И чем больше тысяч ты им щакинешь, тем больше ннйросетнй и фильтров они используют ;)"
171,"[id383418147|Иван], мне все же кажется что они использовали какую-то старую нейросеть, новая по типу Lensa может с нуля нарисовать, делает это быстро, и красиво.
Вот примеры как она меня нарисовала."
172,"[id383418147|Иван], там много разных эффектов, есть действительно с наложением, она там и одежду заменит, но делает она это круто, все равно не сходится.
Ааа, может они просто в Фотошопе накидали всякого говна, вот и продают так?)"
173,"[id552225977|German], это ж Пол Дано"
174,Покажи ей...
175,"Сейчас можно за пару минут через нейросеть,самому распечатать и вставить в красивую рамочку 
Так что с бизнесом вы обломались"
176,"Никуа, султанша из Великого Султана теперь портретом настоящего художника-портретиста стала, лол"
177,Куколды где вы
178,
179,Ну если только на 1 апреля теперь
180,Какое же говнище для конченных! Верните очкастую бабку в короне!
181,"Да и правильно, нах нужна бородатая жена"
182,"Че пи@деть то?! Видно, что это мужик"
183,"[id443403349|Марк], и где ссылка то"
184,"[id673197987|Марина], поменяла пол"
185,Ручищам тоже позавидуют некоторые мужики 😅
186,Правильно сделал нах нужна бородатая баба
187,"[id273522846|Александр], с набухшими яйцами"
188,"Мужик, и руки тоже мужские и груди нет, это хитрый индус грохнул жену а сам притворился ею"
189,"[id13753451|Елена], хороший сюжет для Болливуда)"
190,"Знойная женщина, мечта поэта!"
191,Красотка
192,"[id440150105|Марина], 🤣🤣🤣🤣🤣🤣🤣🤣🤣 жесть"
193,"[id440150105|Марина], очечи Саурона"
194,"[id440150105|Марина], мы люди простые, нам показали и мы сразу достали..."
195,Sultan Ibn al nastya
196,женщины чалму не носят
197,"Да, уж от такой и в шок впасть можно!"
198,Поставки новейшего вооружения от НАТЫ для тех у кого есть бабло на новое железо
199,этот парень только что расстрелял месячный бюджет Уганды
200,"[id517874687|Ян], весь бюджет уганды"
201,"[id517874687|Ян], весь бюджет западных стран🤣🤣🤣🤣🤣"
202,"[id517874687|Ян], коммент супер) от души поржал🤣"
203,"[id409560879|Макс], и каков этот бюджет? Меньше бюджета Сызрани, видимо? Цифрами оперируй вместо инфантильных смайлов."
204,"[id409560879|Макс], рф"
205,Arctic Warfare Minigun
206,Ясно
207,🤣🤣🤣🤣🤣🤣🤣
208,Но твои тиммейты и с ним не смогут👌
209,крутой
210,
211,
212,
213,"ЛЕГНДАРНАЯ ФИНКА нквд ОБРАЗЦА 2022 ГОДА С ГАРАНТИЕЙ - ДО РАСПАКОВКИ И ДОСТАВКОЙ ОТ 2Х МЕСЯЦЕВ.
НАПИШИТЕ МАСТЕРУ ЧЕРЕЗ АДМИНА, У НИХ ОДНИ ОТЦЫ"
214,"Ого, это легендарная финка ЛГБТ? Она даже бумагу режет?"
215,
216,Ну вы поняли)
217,Хуинка
218,???
219,Что-то мой тупой кухонный нож и то лучше справляется с помидором.
220,От Кизлярских Мастеров
221,Против бензопилы норм? Держит блок? 😆
222,"[id42055311|Серега], только если китайской"
223,Легендарная Финка НКВД
224,"Топор теперь бабуля админит? А я-то думал, почему контент паблика изменился"
225,Мусор...кому нужен такой шлак?
226,Как эту  внучку заказать на пару часов?
227,Уже подташнивает от этой подушки!🤢
228,"Скуплю вашу технику!
Адрес: Хорошевское шоссе 88с1. Комиссионный магазин «Победа»"
229,
230,"Конечно, ни одна нормальная женщина не захочет рожать, когда страна ведет войну ("
231,"[id643081644|Диана], и выплата маткапитала под вопросом"
232,
233,"[id791541290|Владлен], Не учи пидерастиков топора плохим вещам, они себе сейчас ссылку сломают на видео."
234,"Наконец есть женщины_ не тупые самки, а те, которые здраво оценивают ситуацию _ сколько могу вырастить, если что_ то пойдёт не так с браком, мужчиной, финансами"
235,"[id208549876|Екатерина], чем больше не тупых самок, тем меньше население ))"
236,"[id26633213|Александр], вам нравятся бездумно плодящиеся, которые потом на каждом углу орут, что им всё должны_ государство, бывшие мужья? Когда ложатся в постель и не предохраняются _ помощь вроде не просят"
237,
238,"[id257349513|Николай], а ты дело говоришь, мой юнный друг..."
239,"А это хорошо, продолжайте вымирать. Естественный отбор называется, скоро ваши места специалисты с аулов займут. А, может уже к старости, будете при шариате жить."
240,"А вы еще больше воюйте — люди тут же побегут рожать (нет, не побегут)"
241,главное чтоб не как в корее где вообще не хотят детей хотя бы одного
242,"а может не надо иметь детей, а просто воспитывать будите?)"
243,"[id152140190|Виктор], Ну и зачем ты ушлепанс не спишь?"
244,"[id537458030|Лена], чтоб такого бота как ты спровоцировать"
245,"[id152140190|Виктор], да что ты говоришь..."
246,"[id537458030|Лена], сработало же, ботяра напал"
247,"[id152140190|Виктор], Ты тут на меня не быкуй, мал еще."
