,0
283,"Ну ясно, что водитель будет виноват, пешеходный переход и тд......но господа пешеходы, с детства втолковывают посмотри налево, дойди до середины и посмотри направо, убедись, что тебя пропускают.....идёт звезда,  в телефон втыкает, как на обочине сохранилась....и пофиг ей, что машину юзом тащит по льду на заблокированных колёсах....."
284,"[id84947487|Юлия], нашла место, где в телефон смотреть."
285,"[id84947487|Юлия], водитель обязан снизить скорость перед пп. И учитывать дорожное покрытие. А он сам в телефоне зависал судя по видео."
286,"[id586055623|Русаков], я не спорю и водителя не оправдываю, но и у пешехода по пдд есть обязанности убедиться в безопасности перехода. Водитель может быть болен, нетрезв, неадекватен, авто может быть неисправно, отказали тормоза и тд...причин в жизни может быть сотня, а вот жизнь у пешехода одна и поднять глаза от телефона может помочь эту жизнь сохранить и не остаться инвалидом."
287,"[id84947487|Юлия], сегодня гололед лютый! Тормозить перед пешком начинала за 200 метров, ABSочка помогала, шипы вгрызались в лёд"
288,"[id586055623|Русаков], да, он козёл и урод, это бесспорно. Но как раз учитывая существование таких и других козлов и уродов, правила дорожного движения обязывают пешеходов перед переходом убедиться, что их пропускают. Этот козёл в худшем для него случае сядет на время, а пешеход ляжет навсегда"
289,"[id84947487|Юлия], выше написал про таких бессмертных... Согласен полностью - порой возникает ощущение, что им жизнь не дорогА от слова ""совсем""..."
290,"[id84947487|Юлия], шла, как царица, свалилась как мешок🤣"
291,"[id84947487|Юлия], ну завтра этот больной, нетрезвый, неадекватный и т.д. въедет другому водителю в лоб и тот погибнет. Что на это скажете?"
292,"[id36724057|Егор], какая связь между вашим вопросом и постом?"
293,"[id36724057|Егор], для того, чтобы этот больной, нетрезвый, неадекватный не въехал в лоб другому водителю, делают разделители встречных потоков, что у нас напрочь отсутствует"
294,У водителя гранты ума 0
295,"Виноваты оба, пешеход в телефоне а водила не смотрит на дорогу"
296,"[id707402345|Дима], виноват водитель! Но в больнице, как ни странно, пешеход... 
Надеюсь, люди посмотрят видео и станут относиться к переходу проезжей части также ответственно, как парень, который шёл следом за девушкой, но смотрел по-сторонам!"
297,"[id707402345|Дима], да тоже в телефоне походу"
298,"[id707402345|Дима], они же все думают раз на пешеходном переходе то безопасно ...забывая о том что погодные условия не позволяют остановить автомобиль моментально! Водила конечно виноват но и пешик мог по сторонам смотреть а не в мобилу-был  бы целее ))"
299,"[id146659606|Олег], ну если ты не можешь остановить машину, заранее видя пешехода, то может стоит права сдать, а машину продать, ибо водить тебе в таком случае нельзя и опасно для окружающих"
300,"[id707402345|Дима], Водила может и смотрел на дорогу , но не учел , что вчера и сегодня разное состояние дороги.. Вчерашние 5 метров торможения , сегодня превращаются в 50 , особенно в местах перед перекрестком или пешеходником , где часто тормозят машины и накатывается лед"
301,"Летают всё ещё на грантах.машина очень легкая.либо не разгоняться по гололёду, либо заранее продумывать торможение до перехода"
302,"[id42272913|Антон], на качественных неевропейских шипах, 175 ширине и правильном давлении нормально она цепляется за лёд."
303,"Уж простите, но пешеход явно из бессмертных, походу.... Редкая(нет сейчас) безалаберность"
304,"именно на переходах и сбивают, не потому что типа маневр завершающий или машину занесло, а потому что считают себя правильными."
305,"[id741990692|Виталий], в данном случае,  в телефоне залипла"
306,"[id741990692|Виталий], да, причём раз в 10 чаще по статистике"
307,"Он на неё специально наехал? Пешеходный переход... Идет пешеход... Что еще необходимо, чтобы остановиться????"
308,"[id556719935|Лариса], лёд под снегом"
309,"[id556719935|Лариса], причём она завершала переход🤦‍♂️"
310,"[id556719935|Лариса], присмотритесь, авто юзом на заблоченных колёсах несёт по льду. Специально? Не думаю..."
311,"[id277079230|Андрей], лететь не надо"
312,"[id84947487|Юлия], Юля не надо оправдывать водителя он виноват полностью он должен учитывать свой автомобиль и дорожное покрытие"
313,"[id277079230|Андрей], вот и надо водителю притормаживать, раз гололед... Знаки для чего висят... Пешеход, конечно смотрел не туда..."
314,"[id586055623|Русаков], если вы глаза свои тоже поднимите, как и пешеход, то в комментариях увидите, что я не оправдываю нигде водителя, а напоминаю обязанность пешеходов по пдд убедиться в безопасности перехода."
315,"[id556719935|Лариса], чё Куку? Лёд на дороге. Наушники вынемайке.....
Щас для всех водила будет виноват,а в чем? Если авто тащит и АБС ТРЕЩИТ"
316,"[id302219401|Андрей], на этом авто нет абс...на видео видно, как зад занесло..."
317,"[id302219401|Андрей], ку ку не Куку... А знак там есть и его необходимо соблюдать... И гололед, как вы утверждаете...А так то, по вам, можно было дальше ехать... Мало ли чего там пролетело мимо..."
318,Где оно...раннее наступление весны??
319,"[id258789376|Сергей],"
320,Погода козёл
321,"[id509584690|Авто], мороз идарас!"
322,Я все жду глобального потепления😬😬😬
323,"Не нужно писать чушь.... Учёные на основе пластов Антарктиды доказали, что погода на нашей планете циклична. Фаза тепла сменяется фазой холода. Влияние парникового эффекта и выбросы фриона, тоже идея так себе.  Хотя для некоторых и цветы стали больше, и жить стало лучше, и небо стало странным цветом."
324,"Наблюдаю сегодня ""глобальное потепление"""
325,"Будем ждать, состояться ли в этом году."
326,"[id39941121|Марьяна], я думаю нет)"
327,Посмотрим))
328,"[id39941121|Марьяна], а если состоиться,то половина групп из заявленного не будет!!!"
329,Тоже увидим. Сейчас загадывать невозможно.
330,"[id39941121|Марьяна], Сплина думаю что точно не будет."
331,"[id179517188|Сергей], мне больше жаль, что не будет Зверей и Луны 🥺"
332,"100 Пудово, нет!!!!!"
333,Лохотрон всеэто!!!
334,"А, ну если Вы говорите, то значит точно не будет."
335,"[id39941121|Марьяна], а у вас есть аргументы, что он точно состоится?"
336,Только у нас могут разогнать всех артистов из страны а потом не возвращать людям деньги за фест который не состоялся )
337,"[id769454110|Вячеслав],  эти артисты сами выбрали свой путь, свалили и поносят Россию. Их никто не выгонял."
338,"[id699749561|Евгений], ахах, ну да) и никто может иноагентами не признавал ?"
339,"[id769454110|Вячеслав], меньше пиндеть нужно было."
340,"[id699749561|Евгений], отличный совет )"
341,"[id769454110|Вячеслав],  тебе то же стоит прислушаться к нему."
342,"[id699749561|Евгений], не думаю что мне нужны ваши советы , и так же не считаю что вы вообще в праве их раздавать"
343,"[id769454110|Вячеслав], да мне нацрать что ты думаешь."
344,"[id699749561|Евгений], отличный ответ )"
345,"[id769454110|Вячеслав], деньги не возвращали организаторы концерта, а не центробанк. Это возможно в любой стране."
346,"[id572082926|Константин], это все должно быть регламентировано , и потребитель должен быть защищен"
347,За такую парашу ещё и деньги платить?
348,"Тоже возвращал деньги за не состаявшийся концерт Linndeman, через чарджбек!!!! Успешно!!!"
349,"Король и шут, зацени у меня) интересные новости узнать не хотите"
350,А администрацию города Бийска не кто не хочет спросить почему так ???
351,"[id596051566|Иван], а при чём тут администрация то?🤔"
352,"[id367745758|Насос], согласование было сними, реклама была по городу! Но некто дальше замарачиваться не стал"
353,"[id596051566|Иван], ну так с администрацией было согласовано только место и дата проведения праздника! Администрация билеты не рапространяла. При чём тут она то!?
Если не поняли, приведу пример. Вы сдаёте квартиру. Квартиросъёмщик решил провести лотерею в съёмной квартире. Сделал билеты и распродал их. Но тираж не состоялся (квартиросъёмщик всех обманул и с деньгами уехал отдыхать за границу). По Вашей логике, обманутые люди должны прийти к Вам и с Вас требовать деньги за билеты?"
354,"А мне всё не могут вернуть деньги за концерт Шина Джихо, потому что ПП по ковиду не отменяют, и я уже даже не знаю, куда плакать..."
355,"[id144596973|Алексаша], такая же проблема. Купила билет на Джихо, как вернуть, не знаю 😭"
356,"[id135925534|Наталья], можем списаться в ЛС и сообща подумать, я завтра с работы могу даже ответами Неоклассики поделиться( и Роспотребнадзора."
357,"[id144596973|Алексаша], можно."
358,"Ребят, новость как то запоздалая. Там считай все кто хотел вернуть, вернули чарджбеком месяцев так 5 назад..."
359,"[id433014341|Владимир], да нет, некоторые до сих пор возвращают"
360,"[id6276429|Кира], Да я не спорю. Просто новость звучит, как будто это первый возврат."
361,
362,а почему отменили этот концерт?
363,"[id780086407|Михаил], а кто их знает. Я смотрю на баннер и мне кажется, что Зеленский на нём)))"
364,"[id780086407|Михаил], орги мошенники"
365,Причина возгорания ?
366,"[id69261125|Олег], причина по фото быта-очевидна, и не важно окурок это был, опьянение или тупость."
367,"[id16479153|Nik], а эл.плитка, возле дивана в зале, Вас не смущает?🤔"
368,"[id69261125|Олег], Лег спать с сигаретой, и кто то поджог кровать."
369,"[id367745758|Насос], меня смущает, думаю хозяев не смущала. Я это и имел в виду)"
370,"[id16479153|Nik], 💯"
371,"[id87836343|Михаил], сами себе хозяева , элементарная техника Безопасности ) но увы , не все ее соблюдают"
372,"[id367745758|Насос], к сожалению это не зал, а обычная комната в малаське"
373,Надеюсь и котейку спасли.
374,"[id160103665|Алевтина], естессно!"
375,"[id367745758|Насос], я то серьёзно спросила"
376,"[id160103665|Алевтина], а Вы лично знаете хозяев квартиры и знаете, что у них есть питомец?"
377,"[id367745758|Насос], увидела лежанку у окна для животного, либо кошка, либо маленький пёсик есть. Знала бы лично, соответственно и спросила лично у них.
Возможно и ошиблась конечно."
378,"[id160103665|Алевтина], а ванночкудля купания младенца Вы не увидели? Или ""котейка"" важнее человеческой жизни?🤔"
379,"Про людей написали, что спасли вообще-то. При чём тут сравнение детей и животных. Наравне важны. Никогда не делю."
380,Пусть все будет хорошо 🙏
381,Надеемся что всë хорошо😢🙏
382,Барнаул
383,Вчера в  Стуково  видела  моя дочь.
384,"ещё фотография, более новая!"
385,
386,
387,"[id20639722|Александр], не смешно"
388,"[id20639722|Александр], зря ты так шутишь браток"
389,"[id20639722|Александр], страшно становится, что за лицами, с виду адекватных горожан, в немалом количестве ходят всякого рода социопаты и дегенераты, и прочая пидэрция."
390,"[id595191499|Дарья], так я не шутил вроде"
391,"[id595191499|Дарья], да это же укробот."
392,"[id20639722|Александр], рот закрой"
393,"[id595191499|Дарья], 🤐"
394,"[id20639722|Александр], вытужила?!"
395,"[id16479153|Nik], чего тебе социофобы сделали? Они ведь наооборот боятся людей"
396,"[id671203567|Ростислав], с социопатом перепутал."
397,"Где и кто ее крайний раз видел? Число , дата , место , время ? Чем занимается и чем увлекается ?"
398,"[id69261125|Олег], никто ничего не знает"
399,"Не может такого быть , не верю."
400,"Конкретный вопрос . Кто ее и когда видел в крайний раз ? Вопрос не сложный , просто подумайте хорошо без паники , спокойно, я понимаю это сложно , но все же ."
401,"Кто и когда с ней крайний раз выходил на связь ? Ветс ап, соц сети ?"
402,"[id69261125|Олег], она в городе была"
403,"[id69261125|Олег], ты что так выясняешь"
404,"Дарья , вы мать этой пропавшей девушки ?)"
405,"[id69261125|Олег],  ты сможешь найти её по хобби?)"
406,"[id69261125|Олег], знакомая)"
407,"[id595191499|Дарья], 🤷‍♀️🤷‍♀️🤷‍♀️человек наверно помочь хочет."
408,найдись живой 😭🙏
409,Наська мы тебя ждем живой 😭😭
410,"[id488444166|Виктория], точно, вернись 😭"
411,"[id488444166|Виктория], а кто это"
412,В сети была в 18:11
413,"[id174754608|Надя], это ее мама заходила"
414,"[id488444166|Виктория], понятно. Хоть бы живой нашлась девочка."
415,
416,Админ прям юморист
417,Он просто попал на темную сторону
418,"Да опять снег валит , только начало таить и подсыхать"
419,"Офигеть какая веселая картинка, прям умора"
420,
421,"[id547163758|Елена], девушка-весна, с длинными ногами, спит себе, спокойным сном…😥"
422,
423,Чето кот в крови
424,"[id161011437|Елена], так весна же! Где-то за кошку дрался..."
425,А мне сегодня 48 стукнуло 😉
426,"Это март в сибири, это нормально."
427,
428,Весна в Барнауле в апреле начинается
429,"[id2940492|Николай], не всегда. Бывает, что и на 9 мая снег пролетает..."
430,"[id367745758|Насос], пролетать то пролетает, но это эпизод, а не тенденция"
431,На улице холод собачий сегодня...о весне е речи нету ...
432,Климат на планете мы просрали!!!!! 🔥🤔
433,Весна:
434,Рановато ещё до весны
435,"Наташа, мы всё уронили🤪"
436,Тут.
437,Заблудилась весна
438,
439,"[id628323401|Настя], если у вас зарплаты не растут то идите туда, где растут, кто вам мешает?"
440,"[id234006426|Дмитрий], вы будто не в России живете"
441,"[id178855493|Жанна], я живу в России, в Барнауле: за последние несколько лет моя зарплата выросла в два-три раза"
442,"[id234006426|Дмитрий], поздравляю вас) но фото свое скрываете)))"
443,"[id178855493|Жанна], для этого вам фото моё зачем-то нужно?)"
444,"[id234006426|Дмитрий], оглянитесь вокруг..."
445,"[id178855493|Жанна], я и говорю: если вам платят мало, как этим водителям скорой, которым дают по 20.000 - увольняйтейтесь и идите на нормально оплачиваемую работу"
446,"[id234006426|Дмитрий], вы так наивны..."
447,"[id178855493|Жанна], в чём я наивен, конкретно?"
448,"[id178855493|Жанна], там алкаш больше 40 т никогда в своей жизни не зарабатывающий ))"
449,"По всей стране проходят митинги именно КПРФ именно по ЖКХ. В Бийске, так похоже, что митинг проходит каждую неделю.
Пермь, Тюмень, Ебург, Каменск.. Такое ощущение, что коммунистам спустили разнарядку дать людям стравить пар через безопасную тему."
450,"[id770092219|Ecet], база"
451,"[id770092219|Ecet], не уже Единая Россия пойдёт, которая подняла эти тарифы. 🤣"
452,"[id770092219|Ecet], пар через безопасную тему? Извините, но это легальная и в чем-то полулегальная борьба, через обращения, акции и прочее.

Это способ скооперировать народ, важно только в правильное русло ли"
453,"[id558117391|Фёдор], ЖКХ, цена билета на трамвай, и т.п. это безопасные темы. А свобода слова, СВО, политзаключённые, сменяемость власти, честные выборы, коррупция - вот эти темы под запретом.
 Коммунистов тоже могу легко понять в выборе протестной повестки - никто не хочет выпасть из окна.
 В принципе, ничего не имею против активности даже в том узком дозволенном диапазоне по методам и по темам, в рамках короткого списка организаций, которым дозволено хоть что-то."
454,
455,"[id509584690|Авто],  👍"
456,"На фоне руин исторического здания, так душевно, так по Российски."
457,Дальше - больше.
458,"все знают что коммунизм это не про зарабатывание денег. Это отобрать у одних и дать немного другим, оставив себе на кармане неплохую комиссию"
459,"[id385812548|Полина], коммунизм это от каждого по способностям, каждому по потребностям, почитайте; думаю, человечество скоро к этому дойдёт"
460,"""- Большие деньги можно только украсть!"" ""- А, заработать?"" ""- А, заработать, Шура, можно только геморрой!"""
461,"[id234006426|Дмитрий], те кто может много работать работают, те кто может потреблять потребляют. Весело придумали..... для тех кто потребляет)))"
462,"[id385812548|Полина], комунизьм это пристанище нищих и никчемных людей никак себя в жизни не реализовавших..."
463,"[id147469292|Константин], это неправда"
