,0
0,🙏🙏🙏
1,🙏🙏🙏🙏
2,❤🙏🙏🙏 СЧАСТЬЯ ВАМ !
3,Молодечик
4,😢🙏🙏🙏❤
5,Надо жить дальше в новых обстоятельствах.
6,"Без глаз жить сложно, но можно. Руки у него золотые, не пропадут."
7,"[id172546920|Ольга], без глаз-очень сложно и страшно, вот теряю зрение, страшно подумать, что будет дальше."
8,❤❤❤
9,Женщина!!! Код русский . Не чета некоторым .....
10,Любви и счастья ребятам! Всё у них будет хорошо!!! 😍❤
11,Когда уже все это закончится....
12,"[id638371301|Денис], тот же вопрос"
13,"[id638371301|Денис], закончится тогда, когда Украина, спонсируемая странами НАТО перестанет представлять угрозу для России. 

Всегда такое условие и было. И в Минских, и в Будапештском меморандуме, и в тех гарантиях, которые наши представители просили от НАТО.. А те не предоставили, потому что на Россию за счет Украины и планировали нападать"
14,"Батька конечно, мы браты, но спички ваши на рыбалке не горят!"
15,😆😆😆
16,👍
17,❤❤❤💪💪💪🇷🇺🇷🇺🇷🇺
18,Главнокомандующий на месте событий.💪✊
19,"[id164408630|Владимир], Ну это обычное дело, как по мне он всё правильно делает, проверяет всё в реальном времени."
20,Надо общения с рядовым составом чтоб  узнать правду
21,
22,"Я вот сколько смотрю, наш везде поспевает слетать и все порешать, пока от Коксового клоуна из 95 квартала, вижу, что способен за пару месяцев в закрытом ангаре собрать местных аклакшей и наградить их за заслуги перед укрорейхом"
23,Икону?
24,Очередная блевотная новость!🤮
25,"Смотрела этот фильм ""Великолепный век"". Только понять не могу, чем же этот век великолепен, когда ради власти, отец убивает своих детей, зачем столько иметь жён и наложниц, чтобы рожать большое количество детей, чтоб потом ради одного, убить других. Фильм красивый, прекрасно играют артисты, но - очень тяжёлый."
26,Моя реакция на данную информацию:
27,Очень важная информация
28,"[id341961088|Карина], в топе новостей, очевидно наиважнейшая информация)"
29,"[id413599219|Светлана], ещё не вечер... Скоро начнут полоскать Пугачеву, не менее четырех постов каждый день; про Бузову, Асмус и прочих..."
30,"[id260121401|Рамилен], это хоть в какие-то рамки заходит. Тут пост о том, что москвичка спасла синичку был репостнут двести раз, вспомнилось незабвенное "" студентка уронила отварную сосиску"""
31,К чему?
32,Каждый раз влюблённым мешали обстоятельства... Суперновость.
33,"Да хорошая и важная,если учитывать нормальный и скажем даже исторический опыт настоящей любви. И не надо хмыкать."
34,Всем доброго утра.
35,"[id505790773|Татьяна],"
36,"[id758745693|Мари], Мари,извините,что спрошу у Вас,Валентин Жданов в сети Вам не встречался?"
37,"[id505790773|Татьяна], не встречался...последний раз был в сети 2 недели назад."
38,"[id758745693|Мари],"
39,"[id505790773|Татьяна], наконец то на конец, ты нашлась то на конец! Тань, прости меня, я сёдня не с кафе на Неглинной и даже не с Волхостроя. Я, как привычно, с колхозу, но это не отменяет мою любовь к красной шляпке и к Питеру! Я тя обожаю!!!!!!!!!!!!!!!!!!!!!!!!!!!!"
40,"Достали новость из своих подшивок еще СССР? Это же так важно, что %usernameman% и %usernamewoman% поженились благодаря, как я понимаю СВО. Но имена изменены, все заблюрено. Информативность бесценная, правдивость информации не вызывает сомнения, текст в слащавых клише. Ж - настоящая журналистика."
41,Когда дурость одного полезна для других :))
42,Скоро ими станут туалеты оклеивать...
43,Значит хорошо живёт.
44,молодец женщина а что государство накормить не может своих бойцов ?
45,"[id613334039|Serega], государство может но многие люди от души хотят лично помогать нашим  бойцам."
46,"[id613334039|Serega], оно кормит,но не так,как Ольга.Низкий поклон этой женщине."
47,"[id613334039|Serega], может и кормит, но паек то стандартный, а женщина может еще и что-то вкусненькое дополнительно военным дать"
48,"Моя знакомая тоже занимается приготовлением таких супов, у них разделено - кто-то привозит овощи,  режут их, варят, кто-то засушивает, кто-то рассфасовывает, каждый на своей кухне, а потом отправляют бойцам"
49,Зачем писать 50летняя? О человеке пишете или его данные-рост вес возраст и т д.?
50,"Молодцы, спасибо вам огромное🥰🥰🥰"
51,"Это ж какая у нее кухня, чтобы открыть минипроизводство на 600 человек?"
52,Рукодельница🙏👏👏👏
53,"👏👌👍Спасибо Ольге и всем женщинам, дай бог вашим семьям здоровья🙏🙏🙏Пусть все наши солдаты вернутся домой живыми, здоровыми🙏🙏🙏"
54,"Милые женщины ,дай бог здоровья вам что помогаете нашим бойцам,Слава России🇷🇺🇷🇺🇷🇺🇷🇺"
55,"Я сам лично посылки на сво отправлял на пасху, пекли куличи для ребят с фронта, чтоб тоже с нами отмечали праздник, горд что есть еще такие люди, что разделяют мою позицию"
56,Начни с наведения порядка на своём участке. Сосед без тебя разберётся
57,"По информации из СМИ, в соседней Белоруссии, если хозяин дома не следит за порядком на своём участке и за домом, то этот дом идёт под снос, а участок переходит другому владельцу."
58,"Каким языком это всё написано? Такое впечатление, что Гугл переводчик с иностранного переводил, такая топорная работа."
59,Да из за этого проклятого СВО куча близких и родных не могут быть вместе
60,"[id731983235|Надежда], Клименко, даже фамилиё кончается на ""О"" Пшла в метро!"
61,"Нашёл твою корочку.
Не благодари :))"
62,Так кто мешает быть рядом с дочерью?
63,Всех денег не заработать!!
64,а дочь сама почему к папе не летит?
65,Грустные глаза постоянно
66,Тёлку взяли в оборот?
67,Нада памочъ.
68,
69,Беда то какая..
70,Новичком траванули?
71,"[id782789000|Евгений], от этого ещё никто не умирал😁"
72,
73,Опять Петров и Баширов🤣😁😊
74,Кто это ? Какая - то очередная звезда ?
75,Ольга Либгардт-звезда заголовков(
76,"Это певица , чего поёт?"
77,"Звёзды на небе, а это шуты и скоморохи."
78,"[id74222342|Андрей], это чудо, сыгравышишь на русском! Где у него сын?"
79,"[id74222342|Андрей], на Майми, вместе с Бузовой!"
80,"На святое замахиваетесь, на сына главного патриота? 🤣🤣🤣"
81,Придумывают себе шоу всякие и называют  звёздами никчемных отпрысков
82,"САМИ, НИОЧЕМ, А ДОЧКА, ВНУЧЕК , ЖУЧЕК , ВСЕХ БЕСТОЛКОВОЕ ПОДТЯГИВАЮТ И НАМ ДУРАКАМ ЭТУ ШЛЯПУ ВТЮХИВАЮТ... КОГДА ЭТО БЕЗДАРНОСТЬ ЗАКОНЧИТСЯ 😭😭😭"
83,Повторять слова Киркорова ? Да ладно....
84,
85,Сами собой восторгаются((. Домашнее пение😢
86,Придумывают себе шоу  а мы должны смотреть
87,"Думала всегда что Газманов истенный патриот, а сыновей на СВО не пустил, упал в моих глазах"
88,
89,Продвигают пассивов...реклама двигатель очка
90,Читать будут из подполы - в первоначальном виде))))
91,Евнухи и извращенцы качают свои права. Нужно выдать им землю пусть свое поселение делают и умрут спокойно.
92,
93,"Так и обзовем его,Красная стрелочка)"
94,Санта Барбара   К чему и за чем
95,"Ни она, ни он ничего великого, да даже достойного в кинематографе не создали. Если бы КП не писала о них через день, в связи с их семейными дрязгами, никто бы этих персонажей не вспомнил."
96,"Ну Павел востребован- еще заработает, а о его жене вообще ничего не знала, кроме того, что она его жена😂😂😂"
97,"[id556441524|Марина], да не скажите, она умничка, просто последние годы была в тени и привознлсила мужа"
98,Ёёёёёптить новость то какая. Ежечасно публиковать нужно. Новость то 🤣😂🤣
99,"типа мы свои АЭС закрыли, теперь вы тоже закрывайте"
100,А как же строительство АЭС в Турции ??? Как собираются этому мешать ???
101,
102,"[id334202805|Валера],"
103,Странное совпадение. Только отказались от ядерной энергии и сразу санкции.
104,"Ливерная Колбаса разбушевался. Остановил  АЭС в Германии, чтобы русским насолить🤣🤣🤣"
105,Оказалось что Европа ни чего не делает для данного производства и решили запретить 18 раз не пускать русские танки в европу
106,А как насчёт хохлядских АЭС?
107,жили не тужили . Греты пришли во власть и пиз&ец подкрался незаметно .
108,"вопрос в другом , что не так с ""нашим"" телевидением .... да и с КП тоже !"
109,"[id386687894|Алексей], я бы даже сказал, что с нами не так?
Если на телеке такие «шоу»"
110,"Посмотрел, разочаровался. За всю передачу ни разу не улыбнулся."
111,💩💩💩
112,проигрывает ваньку ? ургант такие шутки гнал что даже его 6 ка хрусталь не смеялся
113,"По Ване скучаю, что бы кто не говорил!"
114,"Ни тот ни другой не в моем вкусе! Какие то они приторные, слащавые и шутки хамоватые, непристойные..!"
115,"[id760561645|Муха], одним словом-румыны"
116,"[id560006993|Рома], точно! Если учесть, как ведут сейчас себя последние!"
117,Нет спасибо 🤢
118,Все глупость !
119,"Не смотрела- оценить не могу...
Но кажется для такого шоу - надо было найти новое лицо..."
120,"Воля кроме своего комеди клаб, или где он там шутил то, не может на большее."
121,"Никогда бы не подумал что вероятность третьей мировой будет обсуждаться на полном серьезе. Это пугает, потому что уже реально не можешь быть уверен, что этого не случится. Нам нужны переговоры и очень срочно"
122,"[id790495218|Петр], переговоры кого и с кем? И предмет переговоров?"
123,"С чего ""обеспокоенность""?! Для чего передавали?!"
124,Типа не знают зачем Зеля просит у них ракеты дальнего действия 😏
125,Как то неумело сливаются.
126,"США медленно ну уверенна идет к третий мировой , меня кажется они доиграются"
127,"Ну когда уже до Белгородской области долетает то да, и не хуже захаровой выразили обеспокоенность."
128,"[id256024255|Денис], до Курской долетают,а это через Белгород,а ПВО наше  не хрена не может засечь"
129,Поздняк метаться ав уроды и начали а сейчас попа жим жим
130,"С чьей. Подачи они наносят удары ,как договорились?"
131,Ядерной войны не будет  так как если это начнеться это будет не война а уничтожения планеты Земля
132,
133,Пусть попробуют
134,а пусть пробуют устроим им большой пионерский солнцепек ..пусть утешут свое любопытство ..каков он общий кошмар !!!!)))...
135,"Поляков губит азарт. Они сейчас очень активны, а зачем, спрашивается? И так получат свою часть пирога со временем, причём те Львов и Луцк, что они получат, будут беспроблемными городами, бандеровщина оттуда постепенно истребляется в Донбассе, так что вместо агрессии полякам бы ещё ""спасибо"" сказать России."
136,"Боженька дай разума этим людям не лезть в эти отношения🙏🙏,чтоб поскорее эта спецоперация закончилась и настал мир на земле. 🙏🙏🙏. Каждый день читая новости, надежда на мир. 🙏"
137,А что Белый дом или Пентагон обозначили это?
138,Типа сейчас их там нет?
139,Да да они то не дураки подгареть от души.......пусть попугают себя утешат.
140,вот после всего этого начерта ходить на работу ???😏😁
141,
142,Еще 60-х годах прошлого века один старый индеец объяснил всё это одному глупому американцу. А тот попытался объяснить это остальным.
143,"Вот для того и созданы разумные существа, что б был наблюдатель. Я в этом давным давно убеждена  . Это ясно без физики и квантовой механики. 
Если никто ничего не видит и не осознает, то все это не имеет смысла."
144,Это уже давно известно есть Вечный он Создатель и Бог а остальное все временное всего лишь испытания где нам дано  время для создания себя для вечного
145,"Как жаль ,что его нет с нами ..сколько б ещё мог сыграть ролей ! Мне он так нравится !"
146,"Замечательный Человек во всём...
очень-очень жаль, что ушёл так рано...
Вечная память, светлая память 🌹🌹🌹🌹🙏"
147,Светлая память🙏🙏🙏
148,"от одной мысли что больше не будет новых ролей и фильмов с ним, налетает грусть и тоска. Не хватает талантливого актера, порядочного человека😪"
149,Великолепный актер
150,Прекрасный артист. Уважаю. Жаль что так сложилось.
151,"Светлая память мужеству, преданного России человеку."
152,"Эххх, хороший актёр был..."
153,Жалко...... Очень
154,🙏🙏🙏
155,А мы не знали! Бот скидывает...
156,"Мне очень жаль, что я это прочитала. Лучше б,  всего этого не знать. ""Откровения"" через много лет доверия не вызывают. Может, не права. 🤔"
157,Комсомолка все исподнее обнюхивает. Самое пошлое издание в стране
158,Жаль😔
159,Люди-то понимают
160,"[id67891866|Michael], а чё понимают то? Я не въехал,"
161,"[id541343831|Ивашка], американские люди понимают, что шайка во главе Пиндостана им врёт."
162,"[id67891866|Michael], да нет такого народа, как "" американские люди"" , есть цель. И чем скорее мы это поймём, тем для планеты будет красивее!"
163,"[id67891866|Michael], Мишка, я в 90е был слишком честным, я топил за страну и взятка за лимон баксов была оскорблением мундира - так меня воспитали! Я до сих пор такой, почему и катаюсь на Ладе, ну еще копейка в гараже стоит, по оперативке досталась.)))"
164,"[id541343831|Ивашка], да, мы коллеги😊"
165,А где же Петров и Баширов!??😎
166,"Ахах, автор канала в Телеграме взломала Пентагон - вот так бы новость, конечно, зазвучала"
167,Задрали уже с этой Пересильд и Вызовом
168,"… ЮЛИЯ ПЕРЕСИЛЬД … 🇷🇺👩‍🚀✨
 
© космодром #Байконур  ... 28 сентября 2021 г."
169,Пересильд молодец.
170,"Не время восхищаться космосом, у нас другие герои - бойцы."
171,Актрисулька!
172,Пересильд - хорошая актриса  .  Но что то ее много стало на информационном поле
173,"научились снимать 3алупу в космосе, 👏"
174,дерьмо на палочке
175,👎🤮
