,0
308,"Лояльных в природе не существует.
Есть исполнительные. У человека всегда присутствует чувство долга, и он просто выполняет свои обязанности.
А этим пытаются пользоваться в своих шкурных интересах. Как руководство, так и коллеги по работе.
Я был таким, исполнительным. И остался таким, даже на пенсии. Не стоит никому злоупотреблять исполнительностью работника. Он сам знает что и как должен сделать. Иногда в ущерб своему комфорту или отдыху.
А если кто перегибал палку, то мог схлопотать от меня в рыло. Без предупреждений и угроз, молча-тык !
Потом долго и тупо соображали : как это ? что за метаморфоза ? А всё просто: надо маленько трезво соображать и ситуацию примеривать на себя. ( это я обращаюсь к руководству мелкого и чуть выше мелкого уровня).
Вот потому-то моя трудовая книжка ну вся ! вся буквально ! исписана статьями номер 33 КЗОТ.
Зато вот сейчас лафа.
Никто не заставляет высунув язык бежать на "" горбилово"" к восьми утра и не грозит штрафами за опоздание, никто не орёт :"" Почему сидим, почему курим? "" Никто не навяливает за ползарплаты обязанности ещё двоих...красота.....однако-двако-трико..
А я как работал , так и работаю. Сам поставил цель, определил задание, сам скомплектовал и сам выполнил.
Вот почему так ? Кто объяснит ?
Мой совет : если подставили шею под хомут, то не подставляйте ещё и спину под седло, а подмышки под оглобли."
309,"Раньше за лояльность премии выписывали, а сейчас нагрузку увеличивают за ту же зарплату. Лучше всех в колхозе работала лошадь, но председателем она все же не стала.!!!"
310,"Блокбастер? Зачем бомбить мозги? Хороший фильм, и всё."
311,Не пойду смотреть ни за что.Задолбали этим фильмом.
312,Респект ФСБ
313,Дай Боже силы великому спортсмену для преодолнния.
314,Желаем скорейшего выздоровления
315,Желаем скорейшего выздоровления😋
316,Скорейшего выздоровления Роману ❤
317,Здоровья Роману.
318,"Здоровья , здоровья и веры в свои силы"
319,🙏🙏🙏
320,Скорейшего выздоравления❤❤❤
321,"Уходя, уходи!"
322,"[id542046500|Сергей], хрен там, евреи прощаются, но не уходят"
323,Не интересно
324,Отпела Пугалкина.
325,А кому она нужна теперь?
326,"[id156707283|Валя], к старости мало кто кому то нужен"
327,"[id43929814|Владимир], Не в старости дела, их отношение к России"
328,"[id156707283|Валя], относиться к правительству и отношение к родине это разные вещи"
329,"Заколебали мусолить темы о этой старухе, кому она интересна??? Сто лет она не нужна никому"
330,Похоже что Комсомольская Правда очень скучает по Пугачёвой 🙉
331,"Уходя , уходи красиво Алла"
332,"[id195729143|Маргарита], запятую в правильное место переставьте 😁"
333,Забудьте и она обратно вернётся...
334,"У нас очень много хороших певиц. Не хуже, а лучше 
Пугачевой. Пишите о них. От 
Пугачевой уже аскомина. 👎👎👎"
335,
336,"[id505790773|Татьяна], не общаюсь"
337,"[id225693388|Наталия],"
338,"[id505790773|Татьяна], 🙏❤😊🤗"
339,
340,Запутанное дело.
341,А нефиг бухать с депутатами.
342,
343,
344,Жизнь обесценилась сейчас...
345,Может быть там был кто-то третий.  ......
346,"Отчего то сразу было ожидание отмены запуска, понимание, что даже из серьезных вещей должно получиться шоу, не отпускало. Тянули до последнего, и за 40 секунд до аключения двигателей, всё отменили.
Шоу, шоу, шоу...продолжится через 48 часов ровно.."
347,"[id731164896|Василий], при чём тут шоу? Они минут за 20 до запланированного старта узнали о проблеме с клапаном. Решили довести до T-10, чтобы ещё раз системы проверить."
348,"[id731164896|Василий], что? Они последние 10 минут (может и раньше начали, я просто только тогда стрим включил) говорили, что перенос. Отсчёт продолжали чисто для обработки процедуры"
349,"Если это пойдёт на пользу России, то спасибо Пентагону."
350,"Нам дезу, мы дезу, разбирайтесь..Уверен, что нужно, мы и так знали."
351,"[id731164896|Василий], ты, видать, пацан не гордый, так согласен на медаль ? 😃"
352,"Нашли виновного!!!Зеля,скорее требуй денег!!! Штаты виноваты,что вы обос...ты."
353,"Очень хорошо! Держитесь, ребятки! Ждём вас домой у победой! Желаем вам здоровья, удачи!"
354,"В сказки не верю. Стопудово, добавили дезы под шумок, они."
355,"Это точно такая же утка, которая распространялась в январе - феврале 2022 года."
356,Сделают передислокацию в чём проблема. Тем более они пока наступать не торопятся.
357,"[id17192803|Алексей], им бы дырки закрыть в Артемовске, уже же говорили, что тех, кого готовили к наступлению, отправляют, чтоб заменить недостоющих"
358,"Глупо считать, что российская разведка только на какие-то утечки опирается..."
359,Видимо евреев не любит
360,"Она сама ее сначала задела с боку а та ответила,а не разорвала"
361,спойлер : все закончилось хорошо - ведь другая рука то осталась
362,"[id635396451|Михаил], а еще две ноги ..и две почки ......"
363,Акула маловата блин.
364,Сытинький
365,Да всем пох! Вас ожидает грандиозный провал!
366,"Не знаю как кому, а мне актриса Пересильд вообще ни как))))) Может из за нее не хочется даже смотреть эту киношку???????? И сколько бабла туда вбухали?????????? И зачем?????"
367,"Раз столько пишут об этом, то значит стоит и не тратить время на просмотр"
368,"[id256024255|Денис], тогда , судя по количеству рекламы, и на терминатора с матрицей ходить - время тратить! Или о свитых нильзя?"
369,Кто этоооо
370,"[id371354670|Сергей], ""Битва за Севастополь""."
371,🙈
372,"Не диктант, а тест"
373,"Едросы ознакомились с нужными цифрами,я-думаю."
374,
375,"Он конкретно портит асфальт своими траками, как на танке."
376,
377,"[id387553165|Надежда], шумный очень и медленный😁"
378,
379,По квадрату бежит гусеница (цепь).
380,Кто-то не разглядел?
381,Украинский изобретатель
382,"Велосипед изобрели давно, а этот мини трактор ✌🏻ваще бесполезный шумный и еще асфальт портит"
383,Эти люди с квадратными мозгами
384,"Попытка Украины, заукраинить всю Евразию до 2024 года"
385,🐷🐷🏳‍🌈️🏳‍🌈️🏳‍🌈️
386,
387,"Беженцы там получают ~ 300  $ на ЧЕЛОВЕКА( в восточной Европе - меньше) . Жильё бесплатное(из за наплыва не всегда хорошее). Питаться и одеваться можно бесплатно в многочисленных пунктах раздачи. Украина - страна не богатая, в отличие от России, поэтому дома большинство беженцев не зарабатывало и таких денег, а с них на родине надо ещё и платить за всё. А тут сваливается по 300 $ на карманные расходы. Естественно, не все их рационально расходуют. В целом украинцы, как и все русские, неприхотливые и работящие, в отличие, например, от сирийцев."
388,
389,Британия богатая оплатит.
390,У нас то когда начнут о народе думать? Элементарных дорог и газа нет в г. Усолье Пермский край!
391,"[id316939485|Любовь], только о народе эти морды и думают"
392,Как то так...... делиться надо...... До последнего укропа....
393,"А что, кричали же ""Украина цэ Европа"", ну вот получай, Европа)"
394,"Да ладно, неужели они прозрели."
395,"Зелябоба на коксе, ему пох.. ."
396,"[id794941722|Vasia],"
397,Влип парень со своими амбициями .
398,"[id234614878|Антонина], А он уже заранее стал говорить, что будет при потере Артемовска, готовить украинцев, чтоб сильно камнями не закидывали"
399,Да всем у кого есть мозг и так давно всё ясно
400,Это неизбежно!
401,"Какой,какой удар?Психологический!!!Не смешите мои тапочки! Хамство,оскорбления,и.т.д. это обычное состояние укров.А другого псих.удара я не знаю.Кроме как удар по фейсу."
402,"[id505790773|Татьяна], точнее не скажешь!👍пока по морде не дашь- не поймут. Правда,  потом спросят "" за що?""..."
403,"[id363015458|Марина],"
404,Теперь только передоз........ убийца кокаиновый....
405,Куевскому режиму уже пора улепётывать из Славянска😎
406,Им недурно?
407,Как же мы этого ждём!
408,"Это клоун делаеть деньги, по этому по фигу что гибнут народ. Он исполнительный директор Гильотины НАТО, как за скальп Идейцев платили так ему платьят."
409,Продам место для комментария. Дорого
410,"Раньше был настоящий кофе,сейчас дерьмо,после которого изжога."
411,"[id76351565|Лёха], ты пьешь растворимый????
Это же бадяга 100%"
412,"[id462198756|Бернгард], любой,в банках,на азс..."
413,"[id76351565|Лёха], покупайте свежую обжарку +ручная кофемолка 👍 будет"
414,"[id8321055|Дмитрий], спасибо!!! 👍"
415,"Когда-то увлекался арабикой. Работа была тяжёлая и вечером приходилось варить в медной турке. Прямо на работе.
Быстро надоело. Уже через несколько месяцев. Слизистую сушит.
А потом перешёл на тонизирующий травяной настой с клюквой, с черникой. Да хоть и с лимоном.
Гораздо лучше чем эта мутная взвесь в кипятке."
416,Да здравствует зеленый чай!!!
417,"[id657753442|Электрон], пьём чай)"
418,"[id657753442|Электрон], со смородиновым листом..."
419,"Чашечка кофе утром - 👍молотого,конечно."
420,без сопливых скользко..
421,Они хотели рассказатьказать что с Хусейном стало когда пришла демократия в Ирак.
422,
423,По..стилки амереко...вские
424,"Между кем и кем? Все же понимают, что на территории Украины конфликт Запада с Россией, которая отвечает за все сочувствующие ей страны."
425,"Вот наши партнеры все выступают за мирные переговоры, а Украинские ""партнеры"" выступают за военную поддержку, вот вам и разница"
426,
427,Красавчик!
428,Ах цыганенок! Позолотил ручку?!
429,"[id502822612|Владимир], видно, не позолотил - вот его и будут трепать!😁"
430,"[id502822612|Владимир], он индус по рождению. Кажется."
431,Лабрадор
432,Ну вот и до обезьянки абу добрались🤣
433,"Смотрите свидетельство вагнеровцев на канале ГУЛАГу нет. Рассказывают о военных преступлениях - убийствах детей, стариков, женщин. Сегодня вышло видео"
434,"чувак непонятного какого племени, что-то проговорил. 
По идее нужно расследование: показания свидетелей, геолокация."
435,Затыкай ципсо фонтан свой вшивый!
436,
437,
438,Шри
439,"Да что вы говорите? А ничего, что видение происходящего у половины россиян диаметрально противоположное тому, что внушает телевизор? 
Даже если не у половины, а хотя бы у трети - это десятки миллионов граждан, и это миллионы детей."
440,"[id572814494|Юрий], все знакомые и их знакомые, за сво и свержение власти зеленского, супы делают солдатам во многих семьях, а в храмы несут вещи или в народный фронт чтобы отправили на передовую ребятам, и тут я читаю твой комент...представь мое удивление"
441,"[id153402842|Александр], привет. У нас из небольшого села 33 человека на СВО забрали. До драк доходило с теми, кто повестки выдавал. Село как вымерло. Недавно общался с воспитательницей в детском саду. 
У неё сына на СВО. Где-то в Харьковской области. На момент разговора они две недели не видели нормальной еды, хлеб свежий забыли как выглядит. Слоняются по заброшенным деревням, собирают в подвалах разные соленья. Из хороших новостей, - скоро отпуск!"
442,"[id586569689|Андрей], я хз, как у вас в батальене, у нас супы люди присылают, укаждого естб вязаный свитер и носки, и все это от людей."
443,"[id153402842|Александр], людей не хотят привлечь за дискредитацию армии? У армии чего-то не хватает что ли?"
444,"[id586569689|Андрей], странный вопрос, вроде не жалуюсь"
445,"[id153402842|Александр], ответы удаляют. А я из вежливых людей. Отвечу вам всё равно."
446,"[id586569689|Андрей], плохо стараешься... Без надрыву..."
447,"[id153402842|Александр], поддержка солдат не имеет никакого отношения к поддержке линии правительства."
448,они видят огромную поддержку общества.
449,"[id586569689|Андрей], вся наша гуманитарка идёт хохлам, и об это не раз ребята с СВО говорили, просто их затыкают, если до людей дойдут факты того что тысячи тонн гуманитарной помощи идут не в помощь нашим ребятам, а хохлам то это будет переворот, но рано или поздно это всплывёт"
450,Егэ ещё не отменили?
451,"[id549537635|Айрат], а зачем его отменять? Сама идея то хорошая, когда по результатам одного экзамена происходит и выпуск из школы, и зачисление в ВУЗ. Проблема в форме и правилах сдачи экзамена. Вот их надо изменить, вернувшись к советскому опыту: вопрос - расширенный ответ."
452,"Бедные дети, мама дорогая..
Спецоперация и так скоро попадет в Книгу рекордов, как самая длительная, а уж о её причинах толком ничего не знают ни учителя, ни взрослые, а не то что дети.."
453,"[id305657591|Андрей], так они живут в это время и могут сами решать, каковы еë причины."
454,"Пожелела Зора деток
с тех пор нет у них конфеток
Зора всё сама сожрёт
а на деток ч**н кладёт"
455,"[id228027|Александр], Могут, но в школе то от них ведь будут требовать ""правильный"" ответ."
456,"[id794941722|Vasia],"
457,"Я так и думал, под шляпой дешёвка, хотя возможно и дурак"
458,"[id794941722|Vasia], Спасибо. Вы очень ""проницательны"" 👍🤣🤣🤣"
459,До сентября нужно что-то сделать.
460,"[id228027|Александр], например, еще одну улицу в Артёмовске занять."
461,"Зачем детям это нужно, у них другие планы."
462,"Серьезно? А кто то позаботился о том, как подать информацию о СВО, таким образом, что бы это было интересно школьникам? Неужели ни до кого так и не дошло, что основная масса детей, очень далеки от происходящего на Украине?"
463,"[id188325575|Борис], да,верно.А ещё потом будет- обухом по голове информация о потерях по-окончании войны."
464,"У всех на слуху недавняя посадка и лишение родительских прав за типа рисунок,  ,, За Мир"". Если ребёнок ответит неправильно на экзамене с точки зрения экзаменающих, значит ли  это, что родителям нужно готовиться на нары, а неправильно ответившему ребёнку в детдом???"
465,"Пусть,для начала закончат всю эту спец.операцию,а потом включают в историю!Они по ходу,даже сами не знают,что такое история!!!"
466,"[id10720259|Елена], 👍👍👍 , сейчас хохлам вооружения доставят и снова в бой, не конца не краю нет, идёт уничтожение старого оружия и испытание нового, не ради освобождения и помощи наши там, это понятно изначально было, о помощи 4 года назад ДНР просили, но тогда мы не ввели войска, а лишь год назад, эти твари Белгородскую и Курскую область обстреливают, а мы не как не можем назвать всё своими именами, война идёт, а не какая спецоперация по освобождению"
467,"[id731983235|Надежда], вам так всрался сброд из лднр?"
468,Да никто и изначально не хотел этого делать))
469,Тарасик всплакнул
470,Очередная сказка пентагона
471,"Не могут - не значит, что не станут."
472,"Ничего, скоро контрнаступление"
473,"[id13081379|Дмитрий], контротступление хозлопидрв"
474,"[id787746951|Паибот], само собой. Драпать будете, чтобы не отодрали.."
475,"Вот к чему приводит эта ""гуманность"". Ребенка нет."
476,"[id7696400|Дмитрий], мне тоже было лет 9, меня стая загнала на забор. Дядька шёл, я ему - дяденька помоги! Дяденька обкакался, сбежал. Собак я люблю больше людей почему то"
477,"[id202959370|Андрей], молодец!!! 💘✊"
478,"я люблю и собак и людей, при условии-человек здравомыслящий и адекватный. а собана на поводке и в наморднике"
479,"[id315481996|Марина], то бишь если какой спасатель, пожарный, или просто прохожий спас бездомную собаку без повадка, намордника он неадекват. Много таких случаев, собака зашла на реку, лёд провалился её спасают. Не напрягайтесь с ответом, для этого думать надо уметь."
480,"[id202959370|Андрей], не обобщайте, плохо то, что. собаки бездомны и озлоблены. и как следствие вот такие последствия, и, я, рада за вас что вы умеете думать"
481,"""Христосоваться"" пошёл? Был услышан, но Пути Господни неисповедимы, не так ли, верующие?

Задал вопрос. В ответ начали хамить двое."
482,"иди лес валить, там твое место, на остальное ума не хватает."
