,0
1827,"[id23204367|Станислав], хорошее решение"
1828,"[id23204367|Станислав], вот и правильно! Только так! Ато всех перегрызут!"
1829,"[id23204367|Станислав], а мужиков посадили за хранение и применение 👍"
1830,👎👎😡жуть.... 😥🙏соболезнования родным.
1831,"Нашей Жуковой,надо показать!"
1832,"Ужас!!!Бедный ребенок,горе большое,как родителям это пережить?"
1833,А может Байден виноват
1834,АХАХХАХАХ ЛОШАРА
1835,"[id789902280|Лейф], ты?"
1836,Поплачь
1837,"[id789902280|Лейф], хорошо 🤧"
1838,"Срочно пробить броню и растерзать этого царька на кусочки, на 30 кусочков, почему нет управы на этих чиновников, почему мы безвластны с этими уродами-машуков гнида, накажите за детей по настоящему"
1839,"[id218892834|Ирина], и родителей вместе с ним, все виноваты."
1840,Отсрел нужно вести постоянно такие ситуации зелёным собак жалко а детей нет
1841,"[id759393697|Андрей], я вас полность поддерживаю. Некоторые хозяева сами не в адеквате, могут спустить собаку с поводка или зайти в магазин с собакой.."
1842,"Парень, ты - лучший!"
1843,🙏🙏🙏❤😔
1844,"Помогай тебе, Господи!"
1845,"Спаси и сохрани, Господи!!🙏🙏🙏"
1846,"Ты Молорик Бра,с Тобой Бог."
1847,У Тебя всегда все будет ок.
1848,Дай Бог крепкого здоровья тебе наш Герой! Пример для остальных! 👍 Ты молодец! Держись Братишка!👍🙏🙏🙏💪
1849,"Помоги ему Господи, крепкого тебе здоровья🙏💕"
1850,
1851,Низкий поклон мужественному человеку.Здоровья и счастья на долгие годы
1852,"[id718251172|Ivanna], 🙏🙏🙏"
1853,"[id718251172|Иванна], даа, теперь у него ""здоровья и счастья на долгие годы"" точно. 
Вы угараете что-ли .
Вам ноги отреж, счастливы до жопы будите ?"
1854,Вот тварь
1855,Сучка
1856,"Пи@ц
Куда катится мир🤦‍♀️"
1857,Их так посадить👿👿👿
1858,Суки
1859,"С каких пор 4,5 года это пожизненно ??? И сучке этой дали 1,5"
1860,Две ублюдины
1861,"Надо любить своего ребёнка, больше чем кого-то ублюдка"
1862,Бедный ребёнок! 😢
1863,"[id61802618|Марина], потом станет взрослым и начнет ее искать."
1864,"[id711325247|Анна], ладно искать, потом начнет над другими издеваться, или стрелять"
1865,"[id61802618|Марина], он станет кратосом и отомстит"
1866,Если дошло до пожизненного значит этот гад убил его.
1867,А что комменты то удаляете ???
1868,"[id2148603|Irisha], и мой удалили...."
1869,"[id363188723|Анастасия], вот почему он их удоляет"
1870,"[id553001787|Иван], я выпуск видела Мужское Женское с этой мамой...Нет слов.... Неужели х.... дороже?"
1871,"[id363188723|Анастасия], а можно название выпуска?"
1872,"[id744129849|Елизавета], 16.12.2019 ""К стене"""
1873,"[id363188723|Анастасия], спасибо✋"
1874,Ужас
1875,Дура
1876,Ебнутая
1877,Это что за ирод🤣🤣🤣
1878,"Мамонька родимая,что у человека в голове...🤷‍♀️Где же такая красота неземная трудится,кто по специальности...😬"
1879,"[id632416618|Елена], наверное спасателем вон какие два спасательных круга😃"
1880,"[id632416618|Елена], продавец в пятёрочке"
1881,"[id632416618|Елена], конечно по специальности?! Жесть!? Чернобыльская красота?!"
1882,"[id389400078|Ирина], ага уродка"
1883,"[id388442856|Татьяна], серьёзно!??Я бы не взяла такого человека на работу,она фейсконтроль бы не прошла!🙅😬😝"
1884,"[id632416618|Елена], да шучу дают написано ведь что такие же как она"
1885,"[id388442856|Татьяна], раньше был цирк уродов,они гастролировали по миру,там она бы пришлась ко двору,звездой бы была.Опять же свои кругом!!!😁"
1886,"[id632416618|Елена], 🤣🤣🤣"
1887,"[id632416618|Елена], а спектакли были или выступления  или просто приходили на других поглазеть. Себя показать"
1888,"Ну что тут скажешь...слов приличных не подобрать. Её тело, её дело. Но смотреть на это страшновато. 🙄"
1889,
1890,"[id31009991|Алёна], 👍"
1891,"[id11170216|Сергей], 😊"
1892,"[id31009991|Алёна], это точно"
1893,"[id31009991|Алёна], в точечку"
1894,Что ноете? Сами хотите чтоб у бабы большие тити были?
1895,😳😳😳
1896,Чё за кошмар
1897,"[id288984377|Алина-Маникюр], 🤣"
1898,Фуууубля
1899,Нет слов.....
1900,Сколько будет это продолжаться? Опять пострадали дети! Электрический стул этой твари!!! Соболезнования родным и близким детишек!
1901,"[id365745014|Наталья], Это не у нас в Бразилии"
1902,"[id742223788|Крис], не у вас в бразилии? А где?"
1903,жесть. надо пожизненно
1904,"[id315182751|Жанна], надо расстрел."
1905,"[id315182751|Жанна], Я не кровожадная,но если наше государство не может содержать больных людей в изоляции,лечить зачем их,родные понятно сделать это не смогут,(да бывает и не хотят) зачем их содержать на пожизненном?"
1906,
1907,"[id315182751|Жанна], в кочегарку надо"
1908,Да зжигать
1909,"Просто пи*дец 🤐даже смерть для него не наказание, чтобы горел вечно в аду😡"
1910,"[id750747557|Алия], это мягко сказано"
1911,Аха на голову больной. А топор то взял и знал что делать.
1912,Опять  с&ка весна...опять страдают дети..  почему эти больные ублюдки не под наблюдением ??когда эта х%%йня уже закончится ????? Нет слов
1913,Кошмар
1914,Что то не вериться
1915,И смысл таких кормить в тюрьмах ?тем более после такого
1916,Почему психов выпускают на свободу?
1917,"[id137530441|Мария], он не на свободе"
1918,"[id137530441|Мария], вот и меня возмущает тот факт, что они среди нас. Считаю, что психически больные люди должны находиться в спец.учреждениях. Это же бомбы замедленного действия, никогда не знаешь когда рванёт. А у нас как всегда, сначала мы дожидаемся пока что-нибудь случится и только потом действовать начинаем. А жизни уже не вернуть…"
1919,"[id137530441|Мария], есть такая система «служба защиты прав», вот им надо задать вопрос на самом деле это страшно"
1920,В наше время психиатрические лечебницы должны быть сплошь и рядом. Каждый второй психически нестабилен.
1921,"[id485579294|Светлана], согласна 🥺"
1922,"[id137530441|Мария], потому,что лечить и содержать их дорого🤷‍♀️"
1923,"[id137530441|Мария], потому, что лечение стоит денег, а никто не хочет тратиться"
1924,"[id7820318|Анна], а как определить психопата до того, как он что-либо сделает. А надо ли человека держать в спец.учреждении, если у него  в голове порой бывают фантазии о жестоких расправах и расчленёнке, но воплощать их в жизни и мысли нет? Он считается психом?"
1925,"[id137530441|Мария], а это все экономия. Раньше с такими оецедивамт держали под постоянным наблюдением. Сейчас,пролечат и выпускают."
1926,"[id137530441|Мария], есть  люди , которые до совершения подобного преступления характеризуется обществом как положительные и адекватные люди.  А есть с виду вспыльчивые и эмоциональные , даже на учёте стоят , а по факту и мухи не обидят. 
Существует мнение , что все люди психи. В больнице только те кто спалился"""
1927,
1928,"Я три года мучалась, все перепробовала, а месяц назад ""патрон"" попробовала. Только трупы и успевала выметать"
1929,а где его найти
1930,"[id794300548|Любовь], я тут заказывала - https://vk.com/im?sel=-182970495"
1931,"Девочки, не верьте никому и берите только проверенное! Если бы не это средство, я бы на улице уже жила - https://vk.com/im?sel=-182970495"
1932,"После квартирантов думали уже будем продавать квартиру, потому что никак не могли вывести этих гадов..( Купили Патроны по совету подруги и через неделю вымели всю колонию в совок. Спасибо за ваше средство! 
Брала тут - https://vk.com/patron_tut"
1933,Просто уехать от туда
1934,Ovide total
1935,Чистота залог здоровья
1936,Мама таракан и ее детки
1937,Бессвязный текст
1938,Никогда не поверю в такой бред
1939,"[id476487869|Руфь], ну какой это бред? Что разве не умирают люди на операционном  столе или после операции?"
1940,"[id476487869|Руфь], это не группа а кошмар"
1941,"[id689957529|Вера], я о другом вообще то"
1942,"[id469686949|Татьяна], это для количества лайков и коментов"
1943,"[id689957529|Вера], не скажут никогда, что ребёнок сдох. Это очередной бред Ветра перемен."
1944,"[id476487869|Руфь], вы не в России живете наверно. 
Тут каждая Вторая больница с такими врачами... 
Они мало того что тупые, дак ещё и наглые до нельзя и хабалка на хабалке. 
Хорошие доктора, есть, но их так мало и они просто не могут при всём желании всём помочь"
1945,"[id185945633|Татьяна], лечитесь грибами и ягодами у бабки Агафьи... ps.  я в России"
1946,"Им повышать зп только тогда, когда спасен или выздоровел человек"
1947,
1948,Она погиб.. Текст узбек писал🤷‍♂️
1949,"[id730549681|Глаша], история вымышленная, группа провокационная, пишут тексты где -нибудь в США, Англии или ещё где, потом переводят на русский, поэтому такие ляпы. Ошибки в определении рода имён сущ-х характерны для иностранцев при переводе."
1950,"[id514067849|Галина], почему -то я согласна с вами...."
1951,"[id514067849|Галина], да,Я тоже про это слышала,сливают грязь.стараются,пугают,очерняют!а сами лечат парацетамолом от всего.без денег даже в здание больницы не зайдёте."
1952,"[id514067849|Галина], бабушка ребенка давало интервью разве по видео можно сказать что это все неправда? Такое невозможно выдумать."
1953,"[id712044220|Кристина-Максим], запросто, за деньги хоть что скажут."
1954,"[id514067849|Галина], очередной глупый кремлебот.зная нашу медицину в это легко поверить.если что-то хотите конкретное сказать-аргументируйте а не сотрясайте зря воздух"
1955,"[id265057783|Ден], я знаю нашу медицину,не так все критично.А аргументирует жизнь.В этом посте сплошные ошибки,я ,как человек,владеющий англ и немецким ,точно вам могу сказать,что это неумелый перевод .А видео постановочное,за деньги что угодно на говорят.А люди верят."
1956,"[id514067849|Галина], просто у таких людей как вы,больше половины случаев в РФ это постанова.я сам часто столкивался со всякими проблеммами.и медицина не исключение.личный пример.значит повредил я себе ногу.она у меня сильно отекла и распухла.я обратился в травматалогию и с со словами что я перебил сосуд в ноге и кровь пошла внутри под кожу меня отправили домой посоветовав приложить лёд.все.вот она сила нашей мидицины бесплатной,за которые в фонд медицинского страхования вычитается из нашей зарплаты ежемесячно."
1957,"[id514067849|Галина], по этому в нашей стране может быть все что угодно.тут и платить ненадо никому.достаточно просто с людьми пообщаться и материала на подобные сюжеты о медицине будет предостаточно"
1958,"[id514067849|Галина], не поверю,чтоб врач сказал такую фразу""Ребенок там ваш сдох""!!!"
1959,Она погиб на столе???
1960,Бред какойто
1961,Это в Саратове?
1962,Я не верю этому рассказу.
1963,Соболезнования вам..малышке мягких облачков..
1964,😢😱
1965,Есть термин « паническая атака»…а не то что написано
1966,"[id195196294|Галина], правильно. 
И препараты, в данном случае, скорее всего назначил психиатр, а не невро́лог (неврология это немного другая область).
Публикация крива́я какая-то получилась у топикстартера🤷‍♀️😐"
1967,"[id3802545|Анна], здесь поспорю, мне транквилизаторы прописывал невролог"
1968,"[id221781299|Анна], сопутствующие заболевания были, такие как эпилепсия, мигрень, невралгии, инсульты, энцефалит...?"
1969,"[id3802545|Анна], невролог тоже прописывает антидепрессанты😏"
1970,"[id15083783|Мария], если есть сопутствующие/усугубляющие заболевания/патологии🤷‍♀️"
1971,"[id3802545|Анна], именно невролог назначает при таком диагнозе."
1972,"[id3802545|Анна], у меня нет никаких сопутствующих просто ставят ВСД."
1973,"[id15083783|Мария], всд это пережиток. Такой ""диагноз"" ставят когда не хотят или не имеют понятия как разбираться к клубке́ симптомов, которые выдаёт организм."
1974,"[id3802545|Анна], невролог тоже имеет право прописывать рецептурные лекарства, неважно, были ли сопутствующие заболевания, которые Вы перечислили."
1975,"[id3802545|Анна], я знаю. И все же невролог прописывает антидепрессанты🙌🏻"
1976,
1977,"и что, обязательно это надо писать в ВК?"
1978,"[id156142649|Раиса], ну да"
1979,"[id156142649|Раиса], скажите спасибо, что в вашей семье такого не произошло"
1980,"[id647309037|Наталья], вы о чем? Я писала своё мнение автору, вы-то причем?"
1981,А почему об этом не писать? Это реальная проблема для наших детей
1982,Выйдите из ВК и не читайте
1983,"[id647309037|Наталья], ну и пишите своё мнение, для чего вы замечание мне пишите, отнимаете мой время, щекочите нервы?"
1984,"[id647309037|Наталья], вы дура что ли? Чего привязались, а ? Отстань Христа ради"
1985,"Я вас не оскорбляла! Кто здесь не адекват? Не читайте, и не пишите оскорбления"
1986,"[id647309037|Наталья], походу вялотекущая шизофрения у нее была,а родители проглядели"
1987,"[id529150415|Ирина], горе-психологов развелось, ребёнок обратился и чем закончилось..."
1988,"Девчушка хорошенькая,жальее😢😢"
1989,А академку не предлагали и сама не догадалась
1990,"[id446085830|Татьяна], вы её осудите конечно, она это заслужила"
1991,Упала? Или столкнули?
1992,Помянем
1993,"[id346625177|Сергей], понянем..."
1994,"[id346625177|Сергей], самоубийц не поминают"
1995,"[id181228112|Любовь], так это не она... А её рассудок!  Очень жалко девчульку 😥
У вас есть дети?"
1996,"[id346625177|Сергей], суицидников не отпевают и не поминают..... Мои дети тут ни при чем."
1997,Прощать всех нужно. Сколько вам лет?
1998,"[id181228112|Любовь], а МЫ помяним."
1999,"[id346625177|Сергей], у женщин о возрасте не спрашивают))"
2000,"[id52249027|Илья], бухайте с удовольствием))"
2001,"[id181228112|Любовь], у женщин да, но у такой красивой девушки, грех не спросить 😏"
2002,"[id181228112|Любовь], не говорите глупости.Симпатичная лялька."
2003,Естественный отбор
2004,"Печально,"
2005,Дай бог мами сил и терпения 🌹 а мужчинам здоровья крепкого 🙏🙏🙏
2006,"[id672729263|Ольга], так они физически здоровы,а вот проблемы с развитием,отстали,точнее остались в детстве и без матери просто погибнут"
2007,"Благодарю , Господи, что мои дети здоровы🙏🙏🙏"
2008,Да каждому по разному выпадает жизнь.А есть и рождаются нормальными а в жизни становятся идиотами
2009,"[id734302750|Надежда], золотые слова!"
2010,"Здоровья, и крепкого терпения этой сильной женщине"
2011,"[id228328814|Anna], сильная женщина не родила бы аж сразу двоих детей с отклонениями."
2012,"[id187031080|Rekona], у меня ребёнок аутист..  И что мне тоже не стоило рожать его, мой ребёнок это вся моя жизнь.. Ради него только и стоит жить.
Не стоит осуждать, что у кого то особенный ребёнок. Она их любит такими.. Ни кто не застрахован в этой жизни, просто благодарите бога за то, что у вас нормальные дети. Не стоит осуждать.
Я ещё раз скажу.. Это сильная женщина, она достойна быть МАМОЙ.."
2013,"[id228328814|Anna], я вроде не касаюсь вопросов рожать или нет, никого не осуждаю и не пишу о достоинствах 😉 не нужно сову натягивать на глобус"
2014,"Господи, какое наказание, дай бог сил женщине."
2015,"[id643940261|Екатерина], не наказание,а испытание."
2016,"Простите, но они нужны только маме, с нашим обществом страшно подумать, что с ними будет, если что-то случится с мамой.... Пусть у них всё будет хорошо."
2017,"[id62885344|Елена],ну здоровые люди страшнее и опасней  чем они больные! ("
2018,"[id220730056|Lucretia], конечно, и это факт."
2019,"[id220730056|Lucretia], откуда вы знаете это?проверяли?У таких наоборот сил больше ,чем у здорового мужика,если что то не так и они увидят угрозу,это страшнее здорового человека"
2020,"[id255351388|Ксюша], а здоровый человек это делает сознательно за то"
2021,"Мне их очень жаль, никого не хочется обидеть, но повадки прям как у обезьян, интересно.. 🧐"
2022,"[id14030609|Светка], согласна, прям с языка сняли. Интересно, кто их папаша, она их от гамадрила что ли рожала😱🙄"
2023,"[id186709344|Катерина], ужас, что в голове.."
2024,"[id245668346|Kseniya], звенящая пустота и в голове и в сердце....."
2025,"[id186709344|Катерина], Помоги Вам Господь образумиться🙏"
2026,"[id186709344|Катерина], ты уродка. Бойся бога. Не дай бог тебе такого"
2027,"[id407851959|ШУРИК, ]ТАКОГО, не дай Бог никому! Возможно мой комментарий не тактичен, но я никого лично не оскорбила, в отличие от вас."
