,0
720,"[id461472809|Лариса], я поверю. У меня дочь инвалид из-за халатности и неправильного диагноза. И когда из роддома перевозила реанимация  мою дочь, то мне детская врач сказала : ""Если выживет."" На слова медсестры , что я из роддома приеду к ней. А потом эти равнодушные слова от врача: ""Если выживет."""
721,"[id461472809|Лариса], вы врач"
722,"[id461472809|Лариса], как бы это не правдиво не выглядело бы, но сама была свидетелем 1 раз примерно такого же изречения врача молодой девушке."
723,"Знаете, никогда не забуду ситуацию. Дом, бабуля в гробу, скорбящие родственники... Заходит врач (которого ждали, но он решил приехать позже на несколько дней). Видит крышку гроба и гроб: - ""А померла бабка?!"" Разворачивается и уходит."
724,"[id710143386|Василий], нет"
725,"[id222807433|Галюсик], в хамство и я верю, но именно вот так даже самый хамоватый врач не сообщит о смерти!"
726,"[id461472809|Лариса], это конченная группа !"
727,"[id461472809|Лариса], вы правв"
728,Царствие небесное ангелочку!
729,"Ребёнок наверняка родился  с гемолитической желтушкой по резус фактору,у кого то из родителей положительный,у другого отрицательный. Врачи обязаны были сделать переливание крови СРАЗУ. Не хочется верить в неграмотность  врачей."
730,"[id495098330|Наталья], цирроз печени скорее всего, какая желтушка"
731,"[id495098330|Наталья], родители...дети"
732,"Родная мать накрасилась, даже «не на мокром месте »,будто соседка ,а бабушка убивается."
733,"[id29929192|Лейла], не надо так судить внешность одно а то что у нее внутри знает только она…"
734,В 11 классе долгожданный ребёнок?
735,"[id52584244|Инна], ну может она с 14 пыталась залететь)"
736,"[id52584244|Инна], да, причём обнаружилось это в конце 11 класса. А родила она через год. При этом была всё ещё школьницей."
737,"Да причем тут, долгожданный или нет. Ребенка убили, а эти ублюдки на свободе и лечат наших детей!!!"
738,"[id553049046|Настя], а авторы подобных статей формируют мнение о врачах и не только. Вы точно можете знать,что это правда? Думаю, вряд ли. А вот комментариев,в том числе благодаря ломаному русскому авторы уже много набрали."
739,"[id176502941|Наталья], господи, о чем может идти речь, да и с чего вы взяли что это не правда?"
740,"[id176502941|Наталья], в любом случае, совесть иметь нужно, хоть малую часть"
741,"[id553049046|Настя], с того, что мать забеременела в конце 11 класса, но родила почему -то через год. При этом оставаясь школьницей. Бред сивой кобылы."
742,"[id176502941|Наталья], боже мой, может автор просто так написал. Вы же не знаете на самом деле что и как. А осуждаете!"
743,"[id176502941|Наталья], по чаще телевизор смотрите и новости!)"
744,"[id553049046|Настя], ну вот и пусть подобный материал остаётся на ТВ, где,по крайней мере, говорят на русском языке. А здесь пишут ради комментариев. Не говорила бы, если бы здесь раз не проявились авторы и сами не признались,для чего они это пишут и почему именно таким языком."
745,😱
746,"Бедный мальчик( Сумасшествие матери загубило ему детство, психику и жизнь."
747,"[id2901305|Юлия], Они не родители  ,чудовище,  за столько лет только откликнулись  соседи  ,ужас"
748,Очень печальная история(
749,"[id2901305|Юлия], УВЫ милая  да ❗️а, сколько у нас в России  таких семей"
750,"[id710202897|Rukyat], думаю, таких везде хватает."
751,"[id2901305|Юлия],  к сажиленья"
752,😱
753,Ужас дачего дажилеся
754,"[id757113633|Галина], ужас - это быть на столько безграмотным! Сами  читаете, что и как Вы пишете? Кровь из 👀"
755,А где завалы мусора?🤣
756,"[id205178926|Викуля], тоже хотела бы знать…,"
757,"[id205178926|Викуля], даже плита чистая)"
758,Просто мамаська - так себе хозявка ..Ну а на ремонт нет средств и провести ремонт некому .. Обычная квартира .. Возможно мамаська побухивает .. Я таких встречал ..Печально
759,"[id205178926|Викуля], Они просто мусора ещё не видели Потому и пишут что попало 🤣🤣🤣🤣🤣"
760,"[id205178926|Викуля], мдааа, если для Вас это норма, больно представить Ваши хоромы…."
761,"[id137961333|Любовь], не готовят на ней, вот и чистая! А не потому что регулярно моют!"
762,"[id578071419|Любовь], как это вы определили? Т. Е если дома плита чистая, значит на ней попросту не готовят..."
763,"[id137961333|Любовь], ну если в посте написали, горы мусора, одичавший ребенок и т.д,  значит ребенка кормили чем попало, а не готовили для него. Я думаю так!"
764,"[id578071419|Любовь], ну мы именно фото все обсуждаем, а не то что написано, просто фото как-то неудачно подобрали к тексту)"
765,У нормальных  хуже в квартире бывает.
766,а где завалы мусора? я даже ковёр увидела и плита с раковиной чистые
767,"А где мусор? Обычная кухня, в которой готовят еду. Не вижу бардака. Кровать не заправлена и это всё?"
768,"[id326457727|Татьяна], эти фото не от этой истории... . В этой группе норма поставить левые фотки что бы побесить людей!"
769,"[id111103651|Людмила], И ЭТО☝🏼☝🏼☝🏼ФАКТ"
770,"[id326457727|Татьяна], на кровати человек лежит, отдыхает..."
771,"Не вижу ничего страшного, обычной бытовой беспорядок.... Не надо верить всему что пишут не зная всей ситуации и людей."
772,"[id16786363|Анна],"
773,"Даже печка не зас*'' '' '' '' '' на, вроде и мусор не гора😜"
774,И памперсы юниор!??
775,"Был бы  усатый нянь ,уже давно расстреляли и т п.Женщина в педагогике, что в медицине, в хирургии, и психолог- психиатр, это не их дело, разрушения и только, и не подсудны 😼"
776,"[id357792467|Алексей], бабы вне закона."
777,"Да это так.Ещё О Бальзак нам давно поведал об этом миру, и ещё о самого рождения человечества.Женщина самая безжалостная пехота на земле.Не удивительно , не одно ядерная страна не доверит бабам ядерные подлодки с  боеголовками."
778,Пи...ц ей был бы от меня мразина старая зачем таких тварей к детям пускать?
779,физультурница в школе
780,Я б эту хрень которую она в ребёнка кинула в рот запихала б и сожрать заставила.
781,"[id200966623|Наиля], это банка консервная была"
782,"[id444481755|Сергей], ужас"
783,Уродина
784,Кошмар. В прокуратуру надо идти. И вместе с директрисой гнать из садика еще и другим воспитателям проверку устроить
785,В психушку эту дебилку!
786,Вот овца
787,Сесть ей нах...й .
788,"Когда уже, начнут их не просто увольнять, а садить в тюрьму. Чтобы всем был урок. Это ведь моральное унижение ваших детей и физическое.🤦И ведь она там не одна-Это преступление по отношению к детям"
789,[id353598693|Мария] слова садить нет в русском языке! 😳
790,"[id353598693|Мария], вы своих выплятков воспитывать не пробовали, чтобы  они так себя не вели? Яжематери х@евы."
791,"[id178286374|Светлана], я старше вас , у меня внуки, не вам давать оценку, моему мнению. Имейте сострадания к детям!"
792,"[id602807808|Светлана], с чего вы взяли, что я русская"
793,"[id353598693|Мария],  я совсем согласена по поводу обсуждения, извините если моё замечание вас обидело. Я не думаю что вы старше меня, у меня тоже внуки, не обижайтесь😌"
794,"[id602807808|Светлана], проявляя сострадания и уважения, такого ужаса не будет происходить. И когда комментарии пишите, нужно учитывать, фак... Что вас могут понять не правильно. Это не обида, это реакция"
795,🙏
796,"[id353598693|Мария], ну пишите вы на русском языке…надо полагать он ваш основной способ общения, только грамотность хромает"
797,Ну правильно если 50%  солевую на боксмоде парить любой в больнице окажется
798,"[id397084917|Евгений], Только 50% солевой нету"
799,"[id422231103|アンドレイ],  ну ладно 20 hard"
800,"[id397084917|Евгений], Не в этом дело, 50% это 500мг"
801,"[id422231103|アンドレイ], сори тупанул"
802,"[id397084917|Евгений], ультро соливую🤣🤣🤣"
803,Запретите продавать всякую дрянь
804,"[id404806684|Елена],   вот  тот  случай , когда  не  жалко  ,, деток "" , которые  эту  дрянь  употребляют .
ИДЁТ  естественный  отбор  !!!
И  наркоманов   не  жалко ! А  продавцов   далеко  и  надолго  в  урановые   рудники !!!"
805,"[id289925699|Валентина], Вы ж не забывайте, что они совсем ещё неразумные дети, друг перед другом в школе ""выпендриваются"", показывают свою крутизну, не понимая, что их ждёт потеря здоровья, а то и жизни. Они несмышленыши, поэтому государство строжайшим образом должно запретить всякую продажу ""непотребной"" продукции. Кто-то гибнет, а кто-то карман набивает."
806,[id289925699|Валэээ] вы не понятно высказались!? Поясните . Кого вам жалко а кого нет!?🤔 Ведь жалость здесь о чем?! О системе !
807,"[id493857815|Валентина],   надо  ужесточать  законы   в  отношении  ВСЕХ !!!  В  РОССИИ  господствует   вседозволенность ! 
ДЕТИ  (  уж  не  такие  они  несмышленыши)   пусть  гордятся   хорошими  знаниями  и  спортивными   достижениями  !!!"
808,"А что это изменит? Детям запретят продавать, так неумные родители купят детям ""игрушку"", парение перед классом продолжится. Если запрещать продажу, так для всех возрастных категорий."
809,"[id267585912|Лариса],   сколько  ВАМ  лет ???!!!  И  в  какой  секте  ВЫ  состоите ???!!! 
СЛЕДИТЕ  за  современными  проблемами   общества ,  если  это  ВАМ  надо ."
810,"[id289925699|Валентина], в урановых рудниках уже давно не заключённые работают)"
811,"[id493857815|Валентина], не правда все все соображают это не каменный век, значит сами выбирают свой путь!!!Я эти годы помню,как на ладони!!!"
812,"[id289925699|Валентина], какой естественный отбор? Или вы в детстве паинькой были и ничего не хотелось попробовать? Какой отбор,? Вы сначала думайте,а потом пишите...."
813,"[id267585912|Лариса], если это мне, то я радости ИП есть вовсе не веду. Ужесточить продажу этих непотребностей ( вейпов) для малолеток. Со стороны родителей бесконечное напоминание об их вреде и потере здоровья и жизни."
814,Ну видимо он не ребёнок раз он считает что ему нормально этой фигнёй заниматься.
815,"Дети ВЕЗДЕ ВСЁ И ПРО ВСЕХ ЛУЧШЕ ЗНАЮТ ЧЕМ КТО ЛИБО ДРУГОЙ, чё первый раз чтоль? И этот не исключение, он ЛУЧШЕ ВСЯКОГО ВЗРОСЛОГО И ЛУЧШЕ ВСЯКОГО ДОКТОРА ЗНАЕТ ЧЁ ДЛЯ НЕГО ЛУЧШЕ"
816,"Уже не первый такой случай,почему в думе не запретят эту гадость,ну в край ввели бы продажу этой чуши с 18 лет,а лучше конечно с 40😁"
817,"[id103950157|Ксения], деньги деньги"
818,"[id598126444|Денис], ды понимаю я это,но если малолетки это курят,то полюбэ это не их заработанные деньги🤷‍♀️"
819,"[id103950157|Ксения], там деньги по цепочке идут ""нужным ""людям"""" а ребёнок курит или не ребёнок им.......вы поняли"
820,"[id103950157|Ксения], продажа с 18 лет только разрешена."
821,"[id203384659|Ксения], а с какого фига употребляют ее малыши?"
822,"[id103950157|Ксения], хитрые потому что. Просят купить старших."
823,"[id203384659|Ксения], а потом удивляемся,почему у малолеток отношения к взрослым такое неподобающее...рыба гниёт с головы..."
824,"[id103950157|Ксения], да и не только 18 но и 40 хочется жить"
825,"[id103950157|Ксения], можно вопрос? В думе вообще рассматриваются деловые решения? На наркотиках и всякой гадости они наживаются. Моё личное мнение,- разогнать всех к едрени фени. Там ведь умных то нет или единицы. Кто не хочет работать ,все подаются в депутаты."
826,"[id188918766|Татьяна], в думе думают,как бы слинять по раньше,да где отдохнуть получше😁"
827,"Столько информации об этой дряни. А молодёжь такая тупая, всё им надо попробовать. Вообще не жалко"
828,"[id731686926|Елена], себя вспомни в таком же возрасте."
829,"[id397084917|Евгений], ничего плохого не делала, ни курила и не пила спиртные напитки."
830,"[id731686926|Елена], так вы многое потеряли😂😂😂😂😂😂😂😂😂😂😂😂"
831,"[id618499917|Guzel], я ничего не потеряла. И не жалею об этом."
832,"[id731686926|Елена], 😩 потеряли потеряли😂чувство юмора🫣"
833,Это делается для того чтобы молодежь вымерало делалось как зомби
834,"[id587474471|Олег], судя по твоему русскому, зомби стал ты."
835,"Кто пропускает на наши рынки непотребное? Где Роспотребнадзор и Здравммед??! Потом кулакамиимашут, в СМИ поднимают тревогу. Наведите порядок органы власти!!!!😨"
836,"[id267585912|Лариса], Роспотребнадзор и Минздрав заняты более важными делами, написанием директив и проверками медиков, а то неприведи Боги на тряпке для мытья полов будет пришита ленточка не того цвета или гигрометр висеть не на уровне глаз. За штрафы они премии получают."
837,"[id267585912|Лариса], как они порядок наведут если сами на этом наживаються."
838,"Да, а виноваты ""парилки""
А не глупые дети, которые не осознают всей серьёзности/
Но ничего, скоро будет тоже самое, только с сигаретами)))"
839,"[id356533280|Дмитрий], или чем хуже)
И в итоге все перестанут продавать школьникам)
Кроме сиг, хотя это тоже проблема"
840,"[id356533280|Дмитрий], во-во млять эт пока жареный петух в .опу не клюнет, и ито не факт, правда что ""парилку"" эту и обвинят, ещё в суд подадут на парилку🤣молодёжь же щас умная, ну они уверены в этом по крайней мере(не все)"
841,"""Привет участникам естественного отбора!"""
842,Обоих посадить
843,"[id589588298|Денис], за что?"
844,"[id589588298|Денис],"
845,"[id371273117|Любовь], за неоказание помощи и оставление в опасности"
846,Уроды !
847,"[id37742143|Seva], вы про себя?"
848,Что за врачи пошли ето не врачи а левые
849,"[id669645563|Алиса], это рвачи😈🤬"
850,"А сейчас и врачи и педагоги и прочая братия,-все выкидыши евро образования.."
851,"[id669645563|Алиса], ""ето"" пишется через Э !!!!!"
852,"[id235661712|Светлана], учить меня будешь я ваше мнение не спрашивала"
853,"[id669645563|Алиса],ещё и грубиянка!!!!  🤗"
854,"[id235661712|Светлана], сами допросились"
855,
856,"[id669645563|Алиса], нужно научится признавать свои ошибки.... 
К сожалению не каждый это может, а вот нагрубить, всегда пожалуйста. ... 😊"
857,"[id235661712|Светлана], сама допросилась ваше мнение не спращивала"
858,"Начинаем новую эру, новую жизнь, весь медперсонал в обязательном порядке на переаттестацию и  обязательно назад вернуть клятву Гиппократа!"
859,Врачи конченные
860,"Когда фильмы про них показывают, хочется верить, что врачи все такие хорошие, ответственные, душа за них и радуется и болит, а на деле, не врачи, а бездушные костоломы, безграмотная серая масса!!!"
861,"Зачем всех врачей обвинять в ьезразличии и бездушие, есть и отличные врачи, которые относятся со всей ответственостью и борятся за каждого пациента, проста этому мужчине пришло время покинуть этот мир, но то что эти неврачи пусть понесут заслуженое наказание, и очень жаль что вот от поступка этих неврачей судяи и о других, которые лббят свою работу и добрасавесна к ней относятся"
862,Шо ты б л я т ь несешь кому пришло время покинуть этот мир? добрасавесна б л я ть 😂
863,"[id120828995|Ирина], мне 53 года таких не встречала, разве только в детстве; оптимизм хорошее дело конечно. Но с медициной сейчас труба и караул"
864,"Ужас, 🤭"
865,И вот этим людям мы доверяем свои жизни.  Ужас
866,С ними тоже также поступять
867,"Сколько можно выкладывать старые записи,  про это писали год или два назад"
868,"[id134940120|Екатерина], может год или два,какая разница, если и сейчас это актуально."
869,"А вы всему верите, что выкладывают в интернете?"
870,"[id742955349|Надежда], так админ бы и написал, чем дело закончилось, а то репостят из года в год одно и тоже"
871,"[id134940120|Екатерина], я верю тому, с чем сама сталкивалась."
872,"[id134940120|Екатерина], правильно, здесь вообще непонятно что и как, концовку и я могу придумать)))))"
873,"[id134940120|Екатерина], вам ли не все равно. Вы же подписаны на рассылку"
874,"[id134940120|Екатерина], а это чтоб не забывали и помнили как оно бывает и какие они бывают"
875,"[id134940120|Екатерина], многие ни разу не видели. Если вы видели то не смотрите."
876,Думают что они здоровее да нет
877,"Блин,да люди что с вами?где человечность то?мне плакать хочется из за такого наплевательства!"
