,0
0,Совсем что ли?
1,"[id26552238|Надежда], хочется добавить еб...ь"
2,Нескладный текст. Да и хер..я конечно полная
3,"[id26552238|Надежда], в каждый вборс верите? Читайте внимательно! Ни фамилий, ни дат! Какие-то эксперты! Кто они, когда сказали?"
4,"[id75361941|Владимир], я в новостях это слышала по телевизору."
5,"[id26552238|Надежда], по какому каналу?"
6,По НТВ.
7,"[id26552238|Надежда], одно время гуляла новость о платном школьном образовании. Даже гос.дума закон приняла, только вот номер никто назвать не мог."
8,"[id200214533|Olga], согласна"
9,Хрень
10,"[id753804823|Ирина], это хронь"
11,
12,"[id27022646|Ольга], вы адекватны вообще???"
13,"[id567664980|Анастасия], вполне."
14,"[id567664980|Анастасия], Адекватны."
15,"[id567664980|Анастасия], тебе самой еще учиться и учиться!"
16,"[id75361941|Владимир], опечатка вышла, что дальше?И на ты я с вами по моему не переходила 🤗"
17,"[id567664980|Анастасия], по-моему."
18,"[id567664980|Анастасия], если она так пишет, значит адекватности ноль 🤷‍♀️"
19,"[id27022646|Ольга], для Вас? Конечно же ничего страшного! Бабулек же это уже не касается!)))"
20,"[id52650242|Ксюша], А что ж Вы так неадекватно реагируете? Думаете, Вы самая умная тут? Вообще всегда без ошибок пишите!? 😆 А может Вы учитель русского языка и литературы, а все остальные Ваши ученики? 😆 😆"
21,"[id567664980|Анастасия], не обращайте внимание. Скорей всего, это единственное, в чём он грамотен. Знаете ли, грамотные не всегда воспитанны... 🙄"
22,Бред.
23,"[id439681515|Елена], надеюсь это обнан"
24,"[id739430479|Вика], это банан 🍌"
25,Точно совсем🙈
26,Бред полный
27,Повысится смертность среди родителей. Они может хотели детей в деревню отправить и отдохнуть!
28,"[id214421512|Николай], только с родителями обсуждаем ,что смена не в очень то удобном лагере стоит 66тр !!! Летнии сборы на 12 деней в подмосковье мне обойдутся в 48 тр. Обьяснение смертности каникулами очень милое, доступное лето детям бы сделали чтоб не болтались по улицам, но нет отменим каникулы чтоб уж точно (((( как все печально."
29,"[id214421512|Николай], 🤣 детей рожали для бабушек и дедушек? Отдохнуть решили)))"
30,"[id214421512|Николай], сейчас уже нет тех деревень,куда детей отправляли,и что значит отдохнуть,твои дети,ты и рости их,мы без деревень и бабушек своих выростили,выходит без отдыха."
31,"[id214421512|Николай], 🤣🤣🤣"
32,"[id488539241|Анжелика], с чувством юмора и грамотностью большие проблемы.🤦‍♂️"
33,"[id214421512|Николай], а деревенские ждут не дождутся ваших детей"
34,"[id488539241|Анжелика], получается, что мы, бабушки и дедушки не люди и не имеем право на внуков. Послушаеш таких умников и дико становится."
35,"[id214421512|Николай], 👍"
36,"[id488539241|Анжелика], а вы не задумались что многие бабушки и дедушки только этих каникулы ждут чтобы С внуками повидаться!!!!"
37,"[id195458225|Айгун], от школы отдохнуть охото!"
38,"Старшеклассники экзамены сдают пол лета, когда им отдыхать?"
39,"[id480600408|Людмила], а вторую половину результат поступил или нет ждут."
40,Оставьте детей в покое уже
41,"[id480600408|Людмила], а раньше,как отдыхали???"
42,"[id29222852|Марина], а мы сдавали экзамены в школе пол лета, а потом в институт ещё месяц, ничего всё выдержали, но это же только в выпускных классах так."
43,"[id67151936|Нина], им нечем заняться, новые реформы думают"
44,"[id480600408|Людмила], где так сдают? Мы тоже июнь экзамены сдавали."
45,"[id480600408|Людмила], это мы сдавали пол лета. В июне в школе, в августе в институте, а сейчас в школе сдал и с этими отметками идут в институт. А летом будут провалы, ни к чему хорошему это не приведёт."
46,"[id480600408|Людмила], в советское время экзамены сдавали с 1 июня и уже к 15 , если не раньше выдавали аттестат. А сейчас экзамен сдают 1 , а результат через 10 дней. Десять человек каждую работу проверяют за чем."
47,
48,"[id67151936|Нина], согласен ! На все 100 % !!! Летние каникулы НЕОБХОДИМЫ в полном объёме . А вот программу обучения надо возвращать по аналогии СССР !!! При ней - все всё успевали , дети были более приспособлены к жизни . В советском союзе ВСЁ УЖЕ ПРОДУМАЛИ !!! Осталось перенять лучшие стороны советского образования , но дополнить современными реалиями !!! СССР - сила !!! 💪💪💪🇷🇺🇷🇺🇷🇺"
49,Совсем ебанулись суки
50,Бред
51,Из за дебильной сестры пострадал брат. Нормальные скромные умные девочки не общаются с такими. Блокируют.
52,"[id32731735|Имя], вот именно"
53,"Пусть своих сестер е.ут!!!Охеревшие!!!Пусть такие,которые с такими предложениями сразу катятся к себе на Родину еще оказались и трусливые стаей собрались…."
54,"[id15367501|Анна], они только стаей и ходят. Очкуны. По одному язык в жопу засунут. Проверено"
55,Ну пусть посидят за побои и ращврощение малолетней
56,"Я считаю что брат молодец заступился за свою сестру,а а на чурку должно завести уголовное дело за малолеток."
57,
58,Кознить хачей надо
59,Или пусть катятся к себе на родину
60,Таких мразей надо давить как тараканов.
61,Верните скинов
62,нельзя по одному на чурок идти !эти бараны стадные!
63,таких пол страны к великому сожалению 🤦🏼‍♀️🤷‍♀️🤷‍♀️🤷‍♀️
64,"[id179474934|Юлия], просто кончины люди детей очень жалко"
65,"[id708923283|Евгений], жалко, безусловно…."
66,"[id179474934|Юлия], ну прям пол страны"
67,"[id179474934|Юлия], не правда, таких как они единицы на самом деле, просто мы их замечаем и нам кажется,что их много . Именно таких☝🏻"
68,"[id238399083|Олеся], ну не единицы явно…."
69,"[id179474934|Юлия], да ладно! Не утрируйте!"
70,"[id22701094|Надежда], даже не думала"
71,"Вот таким родителям и назначает государство пособие, бедные детишки..."
72,"[id472353463|Таня], таким родителям всё А некоторым ничего жиреют дети голодают"
73,"[id472353463|Таня], вот вот,а я добиться не могу отказы,хотя заработок не большой в разводе двое детей,ипотека и учеба."
74,"[id472353463|Таня], не надо судить по одной пьяной твари! Не все кто получает пособие так живут. А то что вам не платят, во первых не надо завидовать, это грех. А во вторых можете гордиться собой что вы самодостаточный человек и ваши детки получат все самое лучшее"
75,"[id472353463|Таня], здравствуйте мне интересно вам жалко то что она получает или ребёнка вам жалко вам что в этой ситуации жалко или то что вы не получаете"
76,"Конечно, в этом случае жалко детей, на пособие, которое получает мать, если она нигде не работает, дети первым делом должны быть накормлены и одеты. А если детишки ходят голодные, а мать спит пьяная, дак делайте выводы..."
77,"[id472353463|Таня], без официального дохода не одобряют пособия,родители пью наверное на то, что подколымили. Это дом в деревне, значит по деревне могли помочь с хозяйством соседям за бутылку"
78,"Они и рожают для того, чтобы получать детские.."
79,"[id266759694|Марина], да государство им платить, а кто нормально живёт им пособия нету. Очень не справедливо"
80,"[id75988271|Елена], не несите чушь🤣, медали просто так не раздают😉"
81,"Медаль мать-героиня дают женщинам у которых детей 10 и больше. 
Там очень много критериев. Семья должна быть образцово показательной."
82,"[id75988271|Елена], медали дают за 6-го ребёнка ,но не за 5-го"
83,"[id266759694|Марина], так опека должна следить за этим! От лица государства! А их с кабинетов не вытащишь"
84,"[id266759694|Марина], сейчас пособия получать работать надо"
85,"[id123109294|Минзия], поддерживаю ,мы зарабатываем нам хватает )"
86,Так нищие и алкаши только и рожают
87,"[id606239590|Алексей], молчал бы, не зная правды!"
88,"[id606239590|Алексей], знаю людей у которых четыре, пять, три ребёнка, у самой трое выросли и у всех дети обеспечены, замечательные семьи. И родители работают."
89,"[id185243598|Tessa], знаем правду, видим каждый день.
С чего молчать то?"
90,"[id606239590|Алексей], ну нищета это дело такое...можно иметь все, и в один момент остаться без копейки. Так что про финансову обезпеченность не нужно."
91,"[id606239590|Алексей], так у нищих в большем случае дети толковые, образованные и приученные к труду вырастают, в отличии от обеспеченных мажориков, которые привыкли считать что им все обязаны."
92,"[id98631285|Надюшка], да о нищих речи быть не может. Бедным можно оказаться, в один миг.
Об алкаша разговор ведётся в видео."
93,"[id154544701|Татьяна], да Алексей немного перегнул насчёт нищих. Я в бедной семье выросла, семеро детей. Все работящие, рукастые, все умеем. Шить, вязать, мастерить, строить. И прочее"
94,"[id759019432|Katycha], моя семья тоже не из богатых, но своими детьми я  могу только гордиться)"
95,Надо вообще по всей России убрать алкоголь убрать немедленно зато Страна будет без алкоголя и алкоголь этот грех
96,"[id524510096|Фидель], а хренела"
97,"[id524510096|Фидель], запрет проблемы не решит"
98,"[id524510096|Фидель], не запретят. Алкоголь государству выгодеен, он деньги приносит"
99,"[id524510096|Фидель], 👍👍👍"
100,"[id524510096|Фидель], уже убирали. Были единицы алкашей, теперь полстраны"
101,"[id759019432|Katycha], как были алкаши , так и остались.И запрет ничего не решал, только виноградники испортили. Как пили на свадьбах , так и продолжали пить, а вообще всё в нас самих, всё в наших руках, а не в том, есть алкоголь в продаже или нет."
102,"[id219394020|Алиса] вот! Проблема не в пособиях а в колличестве алкоголя на прилавках и под ними. Слабые духом люди без цели и моральных принципов легко становятся алкоголиками, а обратно очень сложно."
103,"[id524510096|Фидель], ага, был уже один такой «умник»! Ввёл закон о трезвости! К чему это привело? К тому, что были уничтожены практически все виноградники, а народ как пил, так и пил, только самогон, втихаря дома гнали! На каждом празднике были и настойки, и самогон, только все в чайники разливали, чтоб не «спалиться»!"
104,"[id524510096|Фидель], и пособия убрать,чтобы пахать  шли."
105,Работать надо по пренудиловке а не путинские деньги им выделять.
106,"Не грибите всех, под одну метелку"
107,"[id717990225|Наталья], а чего не гребите то? Для чего рожают все? Не работают, деньги хорошие платят. Я знаю сколько непьющих рожают только из за Путинских выплат. Ни образования, ни специальности, работы нет, на тяжёлую работу не хотят идти, например полы мыть или посуду, вот и рожают. Сами так и говорят. Нафиг работать, если можно больше получать, сидя дома.
И обижаться тут нечего.
У нас вот работы доя молодых полно-пекари, кассиры, продавцы, повара требуются. А никто не хочет трудиться. Единицы работают постоянно на одном месте. И то старой закалки люди. Ещё в СССР воспитан. С места на место не скачут. А молодёжь обнаглела.Не хотят добросовестно исполнять свою работу, вот и бегают. Товар на полки выкладывать много ума не  надо, так и это не хотят. Понятно, что устают. Так ведь и мы уставали, дома дети ждали, мужья с работы, хозяйство во дворе.
И никаких пособий. Только то, что сами заработали."
108,"Екатерина, здраствуйте, я говорю за себя, у меня 7 детей все мои, рожала для себя, а не из за выплат, также работала, сейчас сижу в декрете с 7ребенком , держим скотину, большой огород, и мне обидно за себя, что из за таких бичих, всех многодетных обобщает, моим старшим детям по 20с хвостиками, и мне 44,но дети это моя жизнь, так что мне обидно, ведь нас немало таких как я."
109,"[id759019432|Katycha], правильно 👍 ✅"
110,"[id759019432|Katycha], слишком много не пиз..ди"
111,"[id759019432|Katycha], всё равно гребёте всех,я тоже не в восторге от того что на рожали и дома сидят на детские.Но есть и такие которые работают просто у них з/п маленькие и таким и нужно платить( комуто нужно быть санитарками,уборщицами и т.д)Таких много и они действительно не пьют"
112,"[id156092657|Елена], Елена, а эти детские сколько мы, получаем 3 года, а раньше на что детей поднимали на 216 рублей, и как многодетная мне до сих пор платят всего на 5 детей 1135 , это на всех, я не чего не говорю, да для нас многодетных мам, это большая помощь спасибо нашему президенту, но если разобраться, не бухать, и ростить нармально детей, то эти деньги капля в море с нашими ценами"
113,"[id618499917|Guzel], кому сказать нечего и по существу возразить, те и начинают отвечать матом, оскорблениями.
ЭТО ваша позиция, иждивенческая."
114,"[id717990225|Наталья], так они и их пропивают. Вместо того, чообы ещё к ним и подзаработать, прибавить доход в семье."
115,"[id156092657|Елена], я не о доплата малообесенченным семьям, где родители работают и маленькая зарплата. Я о выплатах на рождение детей и о тех, кто вообще никогда не работал. А тем, кто работает, я бы наоборот согласна, чтобы ещё больше платили. Так как у них из за занятости на работе, мало времени остаётся для дома и детишек. Чтобы дети могли посещать в отсутствие родителей разные кружки платные, секции спортивные."
116,"[id717990225|Наталья], всем здравствуйте я вас Наталья тоже поддерживаю у меня шестеро детей и тоже все уже почти выросли детки только осталось от трое несовершеннолетних но я хочу сказать почему вот из-за одних алкоголиков всех под одну гребёнку гребут"
117,Надо увеличить материнский копитал...... Мало
118,"[id755976046|Андрей], с тобой только согласен😁"
119,"[id755976046|Андрей], надо вообще на х..й все отменить.пусть работать идут."
120,"От куда деньги детские, если не работали ни дня"
121,"[id404682671|Ольга], а вот, и оттуда, так назначают, не по справедливости,"
122,"[id404682671|Ольга], по закону"
123,"[id574522379|Валентина], по какому такому закону, кто не работает тем не платят. Нужен оф. Доход. Мы с мужем работаем, а нам отказывают, говорят нам хватает."
124,"[id404682671|Ольга], а мы, налогоплательщика для чего? Которые работали, работают? Налоги платят."
125,"[id759019432|Katycha], ага, для них видимо😕"
126,"[id404682671|Ольга], в некоторых случаях есть право нулевого дохода, например многодетные."
127,"[id404682671|Ольга], по нулевому доходу, если в графе ""отец"" прочерк, как мать одиночка... Таковы законы..."
128,"[id561026952|Юля], таких,, некоторых,, случаев очень много! Прежде чем назначать, пусть проверяют условия жизни, детей и тд. Вот. Тогда будет справедливо"
129,"[id472353463|Таня], сейчас только работающим выделяются средства и мамам до 1,5 лет"
130,"[id404682671|Ольга], согласна с вами полностью, к великому сожалению такие личности как на видео пользуются этим."
131,😳
132,Царствие Небесное!
133,☹
134,Царствие небесное!
135,🙏🙏🙏
136,🙏🙏🙏🇷🇺🇷🇺🌹🌹
137,🙏🙏🙏
138,Светлому человеку светлая память в наших сердцах
139,🙏🙏🙏😭😭🌷🌷
140,"Царствие небесное Человеку  с большой буквы, преданному до последнего вздоха своей профессии🙏🙏🙏👏👏👏"
141,Земля ему пухом🙏🙏🙏
142,Пусть всегда побеждает добро! Молодцы! 👏👏👏
143,По больше бы таких людей .Молодцы
144,Плачу!
145,"[id340785475|Любовь], тоже 🌺"
146,"Дух захватывает, ролик на одном дыхание 🤝✊"
147,👍👍👍👍👍🤗
148,👍👍👍🤗
149,👍👍👍👍👍👍
150,Дай Бог вам здоровья. Хорошую дочь вы воспитали.
151,
152,
153,Кошмар😲😲😲
154,Хах кстати я 2 в ряде коментов
155,"У него недержание, это мужские прокладки"
156,
157,"[id447035116|Майя], 😂😂 тоже так подумала."
158,"[id447035116|Майя], да пусть хоть Докторскую колбасу засунет! Деменция подошла... 😱"
159,
160,Не ну старик совсем из ума выжил в таком возрасте так выглядеть и в обтяг всё носить это капец стыд и срам
161,"[id732952459|Татьяна], так если, правда болезнь, недержание"
162,Пошло
163,Как народного получил так всё понеслось это безумное мракобесие
164,"[id447035116|Майя], ну какое не держание ну явно это не прокладки а если это и так тогда он совсем уже обнаглел в таком виде перед людьми выступать ну это надо прятать прикрывать"
