,0
689,"[id245024294|Елена] олейникова - МАЛОРОСТКА,  НЕДОУМКА...что ты понимаешь и знаешь??? О таком президенте как Путин мечтают многие народы мира!!! 🇷🇺🇷🇺🇷🇺Так как понимают, что это самый человечный гуманистический глава страны... Мудрый, выдержанный, грамотный во всех сферах государственной деятельности!!! ПРОФИ просто!!! 
Сравни с шутом и наркоманом ЗЕЛЕЙ, 👎Байдена с его Альцгеймором,👎голубого Макрона с женой старушкой 👎, Шольца ипохондрика 👎... и прочую фашистскую евробанду..."
690,
691,"[id70623802|Руслана], не дождетесь!"
692,"[id70623802|Руслана], в качестве обвинителя и свидетеля преступлений укрорейха"
693,"До чего тупые и безпочвенные/не только твои/высказывания и комментарии, остаётся только удивляться вашему ""УМУ""и вашей недальновидности!!!"
694,"[id70623802|Руслана], 👍👍👍"
695,Он даже не догадывается что сам окажется на скамье подсудимых во время трибунала
696,"[id527706600|Евгений], на скамье подсудимых во время трибунала в первую очередь окажется Зеленский, за все те зверства, которые он совершил в отношении населения своей же страны"
697,"[id683617007|Анастасия], так этому 💩 место рядом с Зеленским"
698,"[id465398637|Светлана], Медведчук всегда был пророссийским , за что и пострадал ! А вы разве этого не знаете ?"
699,"[id683617007|Анастасия], ничего ему не будет. Порошенко сколько натворил? И что?"
700,"[id683617007|Анастасия], нужно начинать с Ющенко , Порошенко , Турчинова и Сеню (кулю так кулю) не забыть и Зеленского с прихвостнями. А главный гад Кравчук перед Богом отчитывается."
701,"[id465398637|Светлана], не говорите чушь. Он не развязывал войны, он занимался сначала бизнес, а за это под требунал не отдают. А потом возглавил партию оппозиционную. Где здесь военное преступление?. Так что рядом с Зелинским будут сидеть Порошенко, Аваков, кровавый пастор и много их сподвижников."
702,"[id465398637|Светлана], чё ты хрюкнула?"
703,"[id37291645|Александр],   сам свинья!!! 💩"
704,"[id465398637|Светлана], я не понимаю чего ты хрюкаешь! Жрать что ли опять хочешь?"
705,"[id37291645|Александр], с свинотварями не общаюсь."
706,
707,"[id254175775|Макс],"
708,Только в итоге он сам окажется на таком процессе в качестве обвиняемого
709,"[id651159789|Павел], по какой статье?"
710,Старый идиот перепутал фамилию.
711,Этот Гитлер его не так давно из Украины вывез
712,Он вообще какую страну здесь описал? Мне показалось нашу Рашу.
713,"[id482106238|Наталья], а ты кто такая чтобы нашу Россию рашей называть , Вали куда нибудь дороги открыты , тебя ждут с распростертыми в любой стране"
714,"[id482106238|Наталья], не Рашу, а Русьили Россию."
715,"[id482106238|Наталья] ЧУРЯ - ТЫ И ЕСТЬ ЧУРЯ... ПРОВОКАТОР И ПРЕДАТЕЛЬ... Правильно сказали - катись хоть на Украину, хоть к ГЕЯМ ЛГБТ в Европу и США... Там быстро в мальчика тебя переделают, и НАОБОРОТ твоих детей и внуков 👎👎💩💩!!! РОССИЯ ЗА МИР БЕЗ УКРАИНСКОГО ФАШИЗМА 🇷🇺🇷🇺"
716,"[id341446761|Светлана], ооо, взбеленились ни с того ни с сего. И сразу толпой. Все правильно, все, как обычно в Раше.🙋😜"
717,"[id482106238|Наталья] ЧУРЯ - чурюмова - нас, ПАТРИОТОВ РОССИИ - БОЛЬШИНСТВО В СТРАНЕ 🇷🇺🇷🇺🇷🇺, а вас ПРЕДАТЕЛЕЙ И продажных УПЫРЕЙ - малое МЕНЬШИНСТВО 👎👎💩💩...  Это вам ФАШИСТЮГ и бесит..."
718,"[id97864177|Светлана], русский мир 😁🤧🥱"
719,Главное все это пережить
720,А иму терпения
721,
722,"Кстати у него синее ухо. Возможно это признак плохого кровообращения. Отсюда наверное и такие тяжёлые последствия пневмонии, то есть гангрена и так далее. Ему надо было уделять особое внимание своему здоровью, при таком плохом кровообращении."
723,"Деньги ни Бог, но своё дело делают."
724,🙏🙏🙏
725,"Жалко мужика,🙏🙏🙏пусть бог ,ему поможет🙏🙏🙏"
726,Держись ты сильный здоровья тебе и терпения
727,"Для семьи главное, что он жив.😊"
728,С рядовым гражданином так бы занимались ?
729,"[id556682210|Сепаратист], со всеми занимаются,просто многие сами не хотят"
730,Наверное из-за отсутствия н..ой суммы денег.
731,"[id556682210|Сепаратист], не всегда бывает сами руки опускают"
732,
733,Как хорошо. Молодцы
734,Хорошее дело молодцы.
735,
736,А раньше чем занимались?
737,Актуальная разработка для гражданских. Теперь бы ещё реализовали её адекватно.
738,"ну почему для гражданских? тут больше вопрос обороны идет, так что стоит внедрять системы обнаружения дронов в оенные структуры"
739,"[id792883066|Матвей], Дроны стали появляться в глубине России. Это опасно прежде всего для мирняка. На фронте своя кухня и своё финансирование. Если положение не изменится, дроны будут атаковать города всё дальше и интенсивнее."
740,"Устала власть прятаться. Вечно эти дроны снимают их ""скромную"" жизнь. Теперь можно создавать ""защитные купола"" над местом дислокации."
741,Естественно. Поскольку нормой вы - увы - считаете свои мозги. Только над этой вашей нормой даже попугайчики неизмеримо возвышаются.
742,Для кого сделали и так понятно. Все для наших защитников! И поставлять должны им они бесплатно эти детекторы!
743,"[id376652847|Дмитрий], ну вообще МО РФ должны делать закупки оборудования) Хотя если разработка велась вместе с МО рф, то там могут быть и бесплатные поставки)"
744,"[id376652847|Дмитрий], У нас бесплатно только в рот дать могут, цены поднимут в раз десять и продавать будут."
745,"[id147434866|Данил], тебе походу уже не раз бесплатно в рот насували🤣🤣🤣"
746,"[id270239976|Андрей], Я бы не смеялся, страна через лет 20 рухнет, а у них насували"
747,"А почему в коммерческую структуру? Почему их не испытать ""в поле""?
Хотя чему я удивляюсь? Это же Касперский! Коммерсант тот еще."
748,"Кулибины не перевелись на Руси, ищите талантливых и гениальных в своей простоте, решений сложных задач, их много по стране!"
749,1 км это же ни о чем
750,А сколько штук отправят на СВО.Это важная информация
751,"Даже не представляю на сколько Крымские чиновники себя любимых премируют,с выделенных денег Материка."
752,"Увидели, когда к ним в карман залезли?"
753,"[id512278167|Галя],  а я разве написал ,что увидел? Я разве написал ,что залез к ним в карман? Читайте внимательно. Я вижу их особняки , я вижу их льготы и вижу их  гостиницы возле моря переписанные на родственников, я вижу их бизнес. Причем они сами это не скрывают."
754,"[id356082080|Александр], а премии разве не в деньгах выражаются?"
755,"[id512278167|Галя],  на одну зарплату . Даже чиновников  , такие особняки и гостиницы не построишь. Я смотрю вы из той же серии  о чем пост? Раз так яро кинулись защищать чиновников."
756,"[id356082080|Александр], да, время сейчас очень трудное, но особняки эти строились и раньше,и зарплату нашу с их зарплатой не сравнить. 
Не всех надо под одну гребенку пускать, есть и добросовестные руководители. Видим только плохое, а хорошее замечать не хотим."
757,"[id356082080|Александр], не ""ихние"",а ""их""!"
758,"[id543995440|Надежда],  разница не меняется."
759,"[id356082080|Александр], тем более мы сами их выбирали."
760,"[id512278167|Галя], да никто их не выбирает. Они сами себя выбирают. Деньги связи и тем более родственные,  творят чудеса в Матушке России."
761,"[id512278167|Галя], такие им не нужны."
762,"Чинуши они везде одинаковые,все воры поголовного,и уже настолько оборзели,что пора их начинать отстреливать как крыс😊😊😊"
763,"[id789422598|Olege], по себе судите о других?"
764,"[id512278167|Галя], а вы что от имени всех чирикаете?"
765,"Да это в любом регионе. Самое страшное, что это все с одобрения Плешивого гаранта конституции идёт."
766,"[id192649069|Цыфра], заработай доверие народа, встань вместо него, посмотрим на что способен."
767,"[id512278167|Галя], при нем это возможно?)"
768,"[id512278167|Галя], доверие у народа вызывает тот, кто вешает ему на уши сладенькую лапшу о его мнимой величии и взывает к его низменным инстинктам."
769,"[id512278167|Галя], вы стараетесь заработать👍😄"
770,"[id512278167|Галя], а плешивый на что способен?Он Хрущев после войны страну отстроил.В космос полетел Гагарин А это недоразумение за 23 года что сделало? Села вымерли,космонавтика в  ж...е, экономики нет, братоубийство начал.Колония китая.Терпилы вы ватные, придурки."
771,"Если историю знаешь, то Хрущев начал разорять деревни и села. Наделал бед, до сих пор аукается из прошлого. Не забывайте, в каком состоянии страна досталась Путину. Это вам не дом построить, здесь надо страну поднимать, а она у нас самая большая многонациональная."
772,"[id512278167|Галя], 👏👏👏"
773,"Сколько же можно было накормить людей на те бабки, которые Запад тратит, что бы люди убивали друг-друга.🙈"
774,"[id93283338|Олег], а зачем кого-то кормить, если можно, как ты говоришь убивать? все же и так понятно сейчас, что всем интересно лишь нечто противоположное спасению"
775,Премировал себя😂👍
776,"Нет, ну сразу суд и лишение свободы. Я про Иранских военных, мало ли кто не ошибается. Вот к примеру, кучка подонков уничтожила  деревню  Сангми всю, детей, женщин, и ничего. Ну мало ли кто ошибки не совершает."
777,"[id153032818|Татьяна], мало ли... Что там с Боингом малащийским было?"
778,"[id189260917|Yura], ну и что с Боингом Малазийским? Никого не нашли, никого не наказали,."
779,"а можно как то по подробнее, в чём именно бойцы сво соц. уязвима категория? я,конечно,против ничего не имею, но всё же интересно"
780,"[id790016072|Маргарита], там больше решение такое для того, чтобы после СВО было проще людям устроиться на работу и оформляться в разных местах)"
781,"[id790016072|Маргарита], я ветеран боевых действий в Афганистане. Когда то я занимался вопросами реабилитации т льгот ветеранам, так что считаю себя достаточно компетентным в этой области. Сейчас от наших льгот фактически осталось, что над твоим гробом солдаты постреляют и то если живые друзья подсуетятся. Всё остальное-......... 
Можно только вспоминать. Боюсь, что и с этими ребятами может произойти то же самое. И становится страшно."
782,"[id790016072|Маргарита], с точки зрения материальной поддержки, уязвимыми их не назвать, ведь правительство РФ полностью содержат солдат"
783,"[id790016072|Маргарита], суть в том,что если граждане выйдут на гражданочк, то для них будут созданы специальные условия для того чтобы они могли пойти учиться на бюджет"
784,"[id209487851|Александр], события в Украине куда сильнее освещаются,чем тот же Афганистан,из-за чего про героев Афгана уже подавляющее большинство забыло."
785,"[id701708088|Валентина], вот то-то и оно. Это сейчас. А что будет через 30 лет?"
786,"[id209487851|Александр], конфликт Украины и России куда более весом,нежели операция в Афганистане,тем более про это уже хотят в учебниках истории писать,хоть он еще и не закончился"
787,Я всё это прекрасно понимаю и надеюсь на лучшее.
788,"[id701708088|Валентина], на тот момент времени была передача -СлужуСоветскомуСоюз и там каждый раз после воскресного Будильника передавались сводки, видео обзор о ходе спецоперации в Афганистане, постоянно."
789,"щас бы Япония продолжала антироссийске санкции))
Смешные они там все, если честно))
Но мы все перкрасно знаем, что Япония очень сильно зависит от РФ"
790,"[id512278167|Галя], что вы их слушаете,им лишбы Путина объяснять во всем!Как будто других странах около море ничего не построена!Если брать только Турцию там кругом возле моря Отели все  для отдыхающих ,каждый метр земли рассчитано, ничего не пустует!Строят разные компании, бизнесмены кредиты берут и тд.л!И везде во всех странах это так, где море!!!"
791,Обьвенять
792,Очень трогательно!
793,папаня....
794,"[id608037743|Alla], ну, вот, а то всё: ""Мама, мама!"" 🤣😜"
795,
796,
797,
798,Это прям какая то ЛГБТ пропаганда 🤣🤣🤣🤣🤣
799,"[id458992400|Anna], 🤦‍♂️"
800,"[id458992400|Anna], это всего лишь животные, природа ! Не надо приписывать г*овно лгбт переделанное."
801,"[id458992400|Anna], а при чём ЛГБТ? Это как? Тоже ЛГБТ?"
802,"[id458992400|Anna], Вообще ни в тему.. 🤦‍♂️"
803,"[id162101855|Кристина], не суди её, у куры редкое заболевание, ЛГБТ головного мозга"
804,"[id458992400|Anna], то-есть отец ростящий ребенка ЛГБТ, это насколько отбитым нужно быть, что б так считать?"
805,
806,Заботливый отец👍
807,
808,
809,"[id21205478|Ирина], тоже эта картинка перед глазами встала))"
810,"[id21205478|Ирина], Самый любимый мультик детства!!! 👍❤"
811,
812,😢
813,Ужас.
814,
815,"[id293126668|Александр], надо какие-нибудь петиции создавать срочно,иначе только хуже будет."
816,"[id293126668|Александр], на чипирках они деньги делают."
817,"[id581974139|Дима], при нынешних законах самая лучшая петиция это в комментариях написать. А на улице с плакатом увидят, сотрудники доблестной полиции тебя сломают, какую нибудь левую хрень на тебя повешают- и прощай лет на пять."
818,"[id506748995|Владимир], я об этом и толкую"
819,"[id293126668|Александр], Надо отдать должное Терешковой, благодаря её инициативе, в Конституцию в том числе внесли закон о собачках. И потому имеем, то что имеем."
820,"[id348682446|Вячеслав], и не плохие,сидя на попе ровно."
821,"[id662166439|Эрих], Терешковой?😳 Или все-таки Бурматову?"
822,"[id147791983|Наталья], эти упыри сами стаей работают, уничтожают население с помощью псин"
823,"[id293126668|Александр], вы правы чипированных становится всё больше"
824,"[id293126668|Александр], да, аж каждый раз.
Что на собаку не посмотри так каждая первая крови желает"
825,Отлов не помогает и не поможет НИКОГДА.
826,"[id581974139|Дима], нужно гуманно одеть глушитель на автомат и сделать зачистку в данном районе."
827,"[id33071793|Дмитрий],так это во всём городе"
828,"[id581974139|Дима], так это во всех городах"
829,"[id348682446|Вячеслав], тоже верно,но в Оренбурге наверное самое проблематичное уже который год."
830,"[id581974139|Дима], у нас Волгоград тоже ""самый проблематичный"". Хозяйственного хозяина нет."
831,"[id348682446|Вячеслав], аж злость настоящая накаливается"
832,"[id581974139|Дима], не.злости нет против этих псов. Они ермолино ""охраняют"",там колбасу продают..., другие псы виноваты"
833,"Пока ты разбираться будешь,тебе полжопы оттяпают."
834,Пометь их тогда😉
835,Да шучу я😉
836,
837,"[id491700145|Иван], не штрафовать,а посадить."
838,"[id491700145|Иван], смысл штрафов, если дети умирают и становятся инвалидами,получают психические расстройства.
Повышают рождаемость для чего в стране,чтобы их вот так вот собаки убивали и уродовали?"
839,"[id491700145|Иван], я к собакам никогда не лезла,а в разные годы,просто идя мимо, причём в маленьком возрасте на меня накидывались большого размера собаки!"
840,"[id491700145|Иван], хватить фуйню пороть ! понятно ВИ ЗООМУДОЗВОН !"
841,"[id491700145|Иван], ещё бы найти этих хозяев"
842,"[id491700145|Иван], да кто их выкидывает? Стая которую я вижу около центрального рынка города не пополняется.А живёт она там уже на протяжении лет 6-ти, у каждой бирочка даже есть, но вот и на людей иногда кидаются т. к. их там кормят,а значит это их территория."
843,"[id491700145|Иван], открою вам секрет, что в стаи сбиваются уже рожденные на улице собаки! И большинство кошек и собак которых зоозащитники постят ежедневно -« хозяин отзовись, и.т.д.» тоже просто бездомные и никто их не выкидывал! А бездомное животное- это дикое животные, как волк , медведь, лев! Почему если медведь напал на человека, то его убивают? Чем дикая собака лучше медведя?! И вообще , случай вопиющий ! И что делать даже думать не нужно!"
844,"[id491700145|Иван], я тоже высказал свое мнение!"
