,0
2046,"[id632078741|Инна], при чем тут я если Инну светлову по всем каналам показали жесткое изнсилованние было ?"
2047,"[id632078741|Инна], старую дуру тебя )"
2048,[id213869378|Юлия твой ]мозг давно изнасилован
2049,"[id632078741|Инна], держись все будет норм , телевизор не смотри только тебя по всем К аналам показываю"
2050,"[id632078741|Инна], не обращайте внимание на ущербных"
2051,"Как Ковальчук говорил, спутники повесили, смартфоны детям в руки дали — и делай с ними шо хошь... ""Александр К..."" жив хоть ?"
2052,Че т источник какой-то мутный...не обычный ли хайп ловят админы?
2053,"[id369529262|Сергей], по телевизору уже показали  сюжет.( 112)"
2054,Наврали.
2055,"[id373082406|Анастасия], по ТВ уже показали"
2056,"[id632078741|Инна], не видела("
2057,"Там ребенок учителя и повара этой школы забавлялись. Отмазывают, как могут"
2058,Дибилизм полный
2059,Можно ли доверять источнику информации? Откуда ноги растут?
2060,"[id336557111|Ирина], только что в новостях показывали."
2061,"[id336557111|Ирина], вы в чем то не уверены ???
Это ясно как белый день 
охреневшие старые пердуны и в таком регионе 
ничего удивительного ...
76 летний педагог🙄🙄🙄
чему они могут уже научить ЭТО ЕСЛИ БЫ ОН БЫЛ СЛЕСАРЬ ДА  УЧИТЕЛЬ ВЫСШИЙ КЛАСС
а здесь уже все ..."
2062,"[id336557111|Ирина], вот тоже думаю... Спецшкола... Могли и придумать... (Хотя сейчас такие детки, и нормики оговорят ни за что((("
2063,"[id336557111|Ирина], если мэш дал новость, она всегда подтверждается, к сожалению"
2064,"[id336557111|Ирина], у вас гугл отрубили? Проверьте"
2065,"[id567215138|Татьяна], в таком возрасте вообще не надо преподавать"
2066,"Директора не отстранять надо, а сажать.🤔"
2067,"[id446960437|Виктория], На кол!"
2068,"[id446960437|Виктория], на заборе новость висит что вас сегодня слон изнасиловал , дадите комментарий 😂😂😂"
2069,"[id446960437|Виктория], сажать не нужно. Кормить его ещё за наши налоги. Отсидит и выйдет. Смертную казнь ввести для таких. И желательно через посадку на кол."
2070,"[id446960437|Виктория], 🤝🤝🤝🤝🤝🤝"
2071,"[id213869378|Юлия], Вас? Было приятно?😃как ошущения?🤔"
2072,"[id213869378|Юлия], думаете неправда? 🤔"
2073,"[id446960437|Виктория], сжигать живьём."
2074,"[id213869378|Юлия], вот неуместны шутки если вам так весело"
2075,Юля ты вообще нормальная?
2076,"[id446960437|Виктория], точно"
2077,"Это ""русский мир"" в отдельно взятой школе?"
2078,"[id529337327|Игорь], а те стрёмно свой город и республику писать"
2079,"[id200584822|Вячеслав], у меня в отличие от вас профиль открыт. Или для вас главное ляпнуть?"
2080,"[id529337327|Игорь], причем тут профиль😳🤦ляпнул это ты тут сейчас"
2081,"[id529337327|Игорь], это украинская дурь в отдельно взятом комментарии?"
2082,Этому больше не наливаем
2083,"[id582640605|Дмитрий], правильно сказал,время покажет"
2084,А то что он теперь в самарканд катается в место развитых стран его не смущает?
2085,"[id415070552|Денис], эти развитые страны катятся в каменный век"
2086,Думаю в их сбережениях никакого бегства от доллара не появилось)
2087,"Бегство от доллара говорят, а сами все покупки и продажи озвучивают в этой валюте😄"
2088,"[id434870585|Саня], 👍👍👍"
2089,"[id434870585|Саня], покупайте $ 😉"
2090,"[id546285417|Александр], зачем?скоро не будет этой зеленой бумажки по любому!!!"
2091,"[id434870585|Саня], да и свои деньги держат за границей не в деревянных."
2092,"Ага, именно поэтому ЦБ все хранит в долларах, а не в рублях)))"
2093,ловров
2094,Когда уже Лавров перестанет нести бред?
2095,"[id575867481|Александра], когда отправится на ""концерт""!!!"
2096,"[id575867481|Александра], А когда ты перестанешь,недалёкая🤣"
2097,"[id575867481|Александра],"
2098,"[id575867481|Александра], когда сдохнит...какую то пургу несёт..."
2099,"Тридцать лет доллар ""бежит"", а курс растет. Смешно."
2100,"[id181522992|Виктор], значит движется по спирали вверх."
2101,"[id181522992|Виктор], покупайте $$$💸💸💸"
2102,"[id181522992|Виктор], покупайте $ 😉"
2103,Не сразу Москва строилась.
2104,"Российский рубль и китайский юань станут новыми Мировыми Резервными Валютами, заменят доллар и евро, так же как в доллар вытеснил английский фунт стерлингов в годы Второй Мировой войны. 
Исторически смена МРВ совпадает с войнами, катаклизмами и катастрофами мирового масштаба, разрушением всего и началом нового мира"
2105,"[id465763207|Ирина], юань то станет, а вот рубль нет. Не зря Китай торговлю в юанях получил."
2106,"[id329563157|Елена],"
2107,"[id329563157|Елена], и рубль станет!
Россия и Китай основные добыдчики золото и драг металлов!"
2108,"[id465763207|Ирина], тебе пора укол в голову делать"
2109,"[id448399722|Игорь], в вашем и укол не поможет."
2110,"[id465763207|Ирина], и Земля наткнется на небесную ось."
2111,"[id14223552|Serg], ты защитничек умалишенных,не умничал бы тут,а бегом менял свои буквы с аглицких,да на расейские,а то в иноагенты переписан будешь,а то и в шпийены."
2112,"[id465763207|Ирина],  шо, ипять каменный топор??"
2113,"По вашим заявлениям,и зарплаты растут!"
2114,Белорусский трикотаж продавать будут ?
2115,та самая Zara с баZara
2116,"И что будет продаваться в ней?
Zara - и дырка? 😂 😂 😂"
2117,Вот здорово обязательно облачитесь и будем вам счастья а симпатичных людей не осматривайте и не репликайте ртами херпоймешьтэ
2118,"Тогда есть шанс и у Декатлона, раз просто под другим названием можно вернуться"
2119,"[id524103256|Арина], Наверняка вернётся. А то СпортМастер без конкуренции цены задрал в небеса."
2120,"Главное, чтоб Декатлон возвращался не с задранными ценами 😅"
2121,"[id524103256|Арина], Конкуренция всё 'таки существует. Поэтому цены урегулираются с божьей помощью."
2122,"[id524103256|Арина], и Икеа бы вернулась…"
2123,"[id68104882|Аким], разве задрал? за последние пол года сколько хожу туда, не видел, что цены как-то значительно изменились.."
2124,О@уеть новость главное смешные цены не закрылись
2125,Не нравилась мне ваша Zara и поныне не нужна! 🙄
2126,Судя по фото мужчин в юбки предлагают одевать🧐
2127,"[id78572682|Татьяна], представил эту картину, как мы в юбках по Москве по вечерам на прогулку, с мини собачками👍😄"
2128,Что за Зара?
2129,"Опять все европейское барахло к нам придет. Видно там не котируются, а у нас любят иностранщину , даже если это смешно одеть."
2130,"Ну, медаль тоже по идее не все получают"
2131,"[id502221175|Андрей], медали непонятным образом распределяют по школам! На моей практике был случай, когда на медаль в школе шли 2-е, причем на золотую, а роно выделил 1 серебряную, поэтому одного ученика тупо завалили на госэкзаменах"
2132,"[id95466016|Владимир], Чушь! Никто медали не распределяет! Как можно завалить ученика на ЕГЭ?! Вы имеете представление о процедуре этого экзамена?"
2133,"[id719099036|Лариса], я разве говорил про егэ? внимательней нужно быть"
2134,"В школе аттестат и медаль выдают после сдачи ЕГЭ. Так сегодня называется государственная итоговая аттестация. А госэкзамены по окончании школы, по-вашему, что?"
2135,да запросто…
2136,"[id719099036|Лариса], с моим ребёнком училась девочка. Была отличница. Писала работы, сдавала дистанционно. В школе бывала крайне редко. В итоге- золотая медаль в кармане. А ЕГЭ написала, еле-еле порог перевалила."
2137,"[id719099036|Лариса], расскажите пожалуйста про камеры и то что учителя из других школ и они не помогают ."
2138,"[id700451677|Геннадий], Под камерами сидят всё, и дети, и организаторы. Камеры мониторят. За нарушение ученика удалят с экзамена, организатора, не заметившего нарушение, оштрафуют. И у гого лишние деньги?!"
2139,
2140,"[id311275560|Антон], нет, это будет распределяться между штурмовиками Верхнего Ларса."
2141,"Ну тогда отпадает смысл ЕГЭ полностью, в школах тоже коррупция не делась никуда, и отличником можно стать за кругленькую сумму"
2142,
2143,"[id413509673|Михаил], что вы всё за детей чиновников то беспокоитесь. Нужны им эти баллы. Вы о своих беспокойтесь. Больше у вас проблем нет."
2144,"Бред и местничество. Кто с учителем договорится, тот идёт на бюджет??"
2145,"Зачастую учителя испытывают личную неприязнь к отдельным ученикам, а иногда к классам целиком, предвзято относятся... 
 А тут ещё и судьбу детей им решать хотят предложить"
2146,"[id465763207|Ирина], но в пользу отличников что-то надо решить"
2147,"[id465763207|Ирина], вы о гиперактивных детях которых родители воспитывают как скот?"
2148,"[id520535511|Ник], бывает учитель и родитель знакомы и неприязнь между ними, вымещивают на детях"
2149,"Отличник должен сам учиться, ане ждать поблажки от учителя. Атак и будет"
2150,"[id701813016|Залия], бесполезно, надо сменить школу, если по одному предмету идёт прессование"
2151,"[id235021803|Вера], для этого есть соответствующие органы, если, ваш ребёнок прям на 100%не причём"
2152,"[id465763207|Ирина], уже коррупционные схемы распространяют и на учеников. Болото."
2153,"Особенно, если заплатить, как у нас обычно делают, 100 баллов обеспечено, 11 ведь лет ""спрадали"" некоторые бездарности, а после в детапуты, или вместо папы в тепленькое место!!!????"
2154,"[id465763207|Ирина], 👍"
2155,"[id520535511|Ник], на это уйдёт много чиновничей волокиты, а время то летит. Пока они будут разбираться пройдёт несколько лет, а ребёнок потеряет веру в справедливость(что в этом возрасте очень важно). Ушли и точка.
А теперь 2 выших образования, школа по президентской программе... И та училка, как ни в чем небывало, здоровается т. к. соседка"
2156,
2157,"Кто-то предвзято относится, кто-то перестраховывается
Не обьективно получится"
2158,"Любую идею
Можно довести до абсурда:)"
2159,а какие расценки???
2160,"[id737736531|Сергей], думаю 100000 за 100 баллов."
2161,"Понятно, роскосмос мечтает о новом мега распиле денег)"
2162,"[id246907174|Ирина], конечно. Космос в России уже второй год обламывают. Всё бабло на оборону земную отправляют. Там сейчас такой распил что у Роскосмоса слюни текут"
2163,"[id246939942|Александр], а чем плохо что на оборону отправляют?"
2164,"[id505186807|Рафис], всё дело в эффективности. То есть заводу можно заплатить деньги , но там ничего не будет происходить"
2165,"[id505186807|Рафис], тем что,не тем делам человечество занимается. Убивая друг друга. Человечеству нужно объединяться, и мыслить шири. А не как деградация Олигархов, которым ничего не нужно, кроме бабла."
2166,"[id84438376|Максим], что то наговорил черт знает что я так и не понял в чём виновата наша оборонка. )"
2167,"[id505186807|Рафис], деньги идут на истребления людей, есть твари да. Но в целом война, это не тем чем должен заниматься человек в современном мире. Нужно развивать космос и все что с ним связано. Война это деньги Олигархов которые зарабатывают этим, дураки берут оружие и стреляют друг друга."
2168,"[id246907174|Ирина], иди и смотри..."
2169,Ну тебе-то ничего не перепадёт.Таких не берут в космонавты.
2170,"[id84438376|Максим], тебе лучше молчать,чем говорить.Иди хоть писать грамотно научиться."
2171,Как попасть дуда?
2172,космос нужен только для военных целей нашей стране. другого не придумали
2173,"[id95626412|Виталий], туризм"
2174,"[id95626412|Виталий], туризм, сотовая связь, реклама."
2175,"[id95626412|Виталий], а связь,навигатор,ну и разведка тоже нужна,а то партнеры бывшие уж больно ненадёжны стали."
2176,"[id95626412|Виталий], УЗКИЙ У ВАС КРУГОЗОР, А КАКА ЖЕ ""И НА МАРСЕ БУДУТ ЯБЛОНИ ЦВЕСТИ"".........................."
2177,"[id95626412|Виталий], В нашей много всего придумали, в вашей, наверное - да."
2178,"Как-то уже поднадоело, что нам всегда обещают светлое будущее, но настоящее постоянно хреновое. И так всю жизнь.
Роскосмос не исключение - снова обещания при довольно унылой реальности."
2179,"[id156518969|Петр], в чем унылая? 100 пусковой без сбоев, ни у кого такой надёжности нет. Но нам всегда хочется плюнуть в самих себя."
2180,"[id561270675|Сергей], контакты, что привели бы к повышению производства сорваны и запускаются теперь ""с батута"" получив еще одного соперника в космической деятельности."
2181,так с рогозиным и подобными ему можно не только луну проспать
2182,С этим разберетесь сами а что за гусячьи потрошка такие есть рецепт и где-то в пузике у гусятки потрошка и их некоторые детины обожают вот ведь какая ирония была в сказках а тут реальный космос страх то какой смысл то есть?? Мать знает куда намылился? Это не у бабца зависнуть тут высота до неба глаза не хватит оту вас разбойники и ученые атуу патуу
2183,
2184,"[id507720477|Людмила], отсыпь, по братски"
2185,"[id161993296|Олег], молодца.... Третьим разрешите..."
2186,"[id765881028|Александр], разрешаю))"
2187,"Был у нас такой Рогозин который про батуты рассказывал. В итоге Россия отстала в космосе на 25 лет, а на земле на 90 лет"
2188,"[id246939942|Александр], в 1000 давай кто больше!!! Накидайте говна на вентилятор. Ничего это другие страны похвалой стоят, а Россия и хайкой сильнее всех будет!"
2189,"[id561270675|Сергей], ты уже Японию раком обскакал"
2190,"[id246939942|Александр], не тыкайте я с вами на брудершафт не пил."
2191,"[id561270675|Сергей], не скули, ватный клоун."
2192,"Мечты, мечты"
2193,Путин мечтает о покорении планет :)
2194,"[id10187695|Юрий], вообще-то это илон ваш любимый мечтает о Марсе. Вы не путайте  2025 там будет колония из таких как вы🤣"
2195,"[id561270675|Сергей], таких как я , не берут в космонавты :("
2196,"[id561270675|Сергей],"
2197,"[id10187695|Юрий], и где там о покорении ?"
2198,"[id561270675|Сергей], 

России следует вернуться к организации миссий на другие планеты, а также как можно быстрее возобновить свою лунную программу. Об этом заявил президент России Владимир Путин в своем обращении по случаю Дня космонавтик"
2199,"[id561270675|Сергей], Маск делает, а не мечтает в отличии от таких как вы."
2200,"[id137039180|Кирилл], что делает? Наш ""Союэ"" скопировал и усовершенствовал, на каждый удачный пуск два три срыва. И про Марс что то не слышно в последнее время. Но для вас он видимо бог."
2201,"[id137039180|Кирилл], у NASA хороший бюджет, могут позволить себе талантливых picture makerov :)"
2202,А мы и Юру просрали…
2203,"[id561270675|Сергей], коль не слышно интересуйтесь сколько уже много всего запущено и возвращено, а некоторые говорили ""это невозможно"""
2204,🤦‍♂️
2205,😅😂
2206,😀👍👍👍
2207,
2208,
2209,
2210,
2211,Давно не смотрим ТВ. Полное ....овно.
2212,Что смотрите?
2213,"[id776247254|Татьяна], ну за всех не отвечайте."
2214,"Есть одноименный отечественный сериал, довольно забавный)"
2215,бред вываливать совсем не обязательно
2216,"..чую...торнадо было лишь разминкой""""("
2217,"NY-ку нужен новый ""герой"" - Ratman (""директор по миграции грызунов"")!... ))"
2218,"[id329656434|Эд], Ганс-крысолов))"
2219,"[id136886476|Маша], норм)"
2220,Крысы нашли себе подобных.
2221,"[id638451060|Ольга],"
2222,"Это очень умные животные, пусть и дальше продолжают жить в Нью Йорке!"
2223,"[id735622497|Николай], 🤣🤣🤣👏"
2224,"О, еще один питер"
2225,"[id4889457|Ян], меня в СПб за пятку летом чуть крыса не кусила. Вовремя увидела. Отпугнула каблучком"
2226,"Как я их боюсь,это нечто.😱 Когда они нападают это страшно..."
2227,
2228,А че за бомжовая?
2229,Пусть покажут московских метровых!
2230,"[id572707209|Екатерина], их уже и не видать бомжи всех почти съели."
2231,"[id137039180|Кирилл], 🤣"
2232,Так они же не воруют...
2233,а Вы заработную плату воруете?!
2234,"[id571070132|Татьяна], так я плачу налог потому что что? Правильно, я использую оборудование работодателя, его помещение... Что используют они сидя дома перед вебкой проводя свои видеоблоги? За свет платят, оборудование куплено и налог с него заплачен..😄"
2235,"[id571070132|Татьяна], учитывая что вы сами смотря их стримы платите и т.д... я имею ввиду зрителей конкретно"
2236,"[id243021525|Владимир], Вы платите налоги на содержание государства, на армию , полицию , инфраструктуру))) за помещение и оборудование платит работодатель. Это два разных понятия."
2237,"[id243021525|Владимир], 👎"
